"subject","course_code","course_name","description","credits"
"Public Administration","PADM 6210","Organization Theory in the Public Context","Behavior and interaction of individuals and groups in complex organizations in public context. Analysis of processes, conditions, and constraints in formulation and implementation of public policy.","3"
"Public Administration","PADM 6220","Leadership and Ethics in the Public Sector","Study of leadership and ethical issues facing policy makers and public administrators, including leadership and management skills, ethical dilemmas and challenges, conflicts of interest and values, and professionalism.","3"
"Public Administration","PADM 6240","Management of Non-Profit Organizations","Analysis of nonprofit organizations in the US with attention to their purposes, organization, management, and roles in public policy development and implementation.","3"
"Public Administration","PADM 6260","Management of Public Information Technology","Fundamental concepts of information management in the public sector. Examination of planning and implementation of information technology and e-government projects.","3"
"Public Administration","PADM 6325","Transportation Policy","Analysis of US public policy toward transportation issues at both the state and federal levels.","3"
"Public Administration","PADM 6400","Health Policy","COHE 6971    Overview of health policy, law and regulation that relate to the delivery of health care in the United States.","3"
"Public Administration","PADM 6410","Health Policy Analysis","Development of policy analysis and assessment skills needed in the health policy field.","3"
"Public Administration","PADM 6887","Internship in Public Administration","One hundred (100) hours per semester are required. May be repeated for up to 3 s.h. P: Consent of instructor or MPA program director.       Experiential learning in a public agency or non-profit setting under the supervision of the employer and the instructor of record for the course.","1"
"Public Administration","PADM 6889","Internship in Public Administration","Three hundred (300) contact hours per semester are required.  P: Consent of instructor or MPA program director.       Experiential learning in a public agency or non-profit setting under the supervision of the employer and the instructor of record for the course.","3"
"Public Administration","PADM 6898","Independent Research","PADM 6189, 6199   P: Completion of 12 s.h. of degree requirements; consent of instructor.      Individualized.","3"
"Public Administration","PADM 6899","Independent Research","PADM 6189, 6199   P: Completion of 12 s.h. of degree requirements; consent of instructor.      Individualized.","3"
"Public Administration","PADM 6900","MPA Professional Paper","P: PADM 6161  or consent of MPA program director.      The purpose of this course is for students to apply the skills and knowledge they have accumulated throughout the Master of Public Administration program by thoroughly analyzing and identifying potential solutions for a public management and/or policy issue. Students will incorporate broader theoretical propositions, systematic approaches of analysis, evaluation techniques, and implementation strategies in their work efforts. The completed work will be defended before MPA faculty members and classmates.","3"
"Public Administration","PADM 6901","Professional Paper: Summer Research","May be repeated. No credit may count toward degree. Students conducting professional paper research may only register for this course during the summer.","1"
"Public Administration","PADM 7004","Marine Policy, Governance, and Law","PADM 6300   P: Consent of instructor.      Processes, politics, laws, and institutions as they affect marine, coastal, and climate policy in the United States.","3"
"Public Administration","PADM 7009","US Environmental Law and Ethics","P: Consent of instructor.      Role of law and the judicial system as these affect coastal, marine, climate, and environmental policy and ethics.","3"
"Public Health","MPH 6000","Public Health Practice","Foundation for public health administration. Introduces MPH degree program. Applied focus on public health problems, issues, and resources of eastern North Carolina. Describes how empirical assessment of population health status informs managerial decision-making and describes the organization of the public health infrastructure. Overview range of practice in public health and of tools and resources for health improvement.","3"
"Public Health","MPH 6002","Ethics and Law in Public Health","Core issues and skills for public health administration and practice. Focuses on public health law, ethics, legislation, media relations, human services management, and emergency preparedness.","3"
"Public Health","MPH 6005","African-American Health","Comprehensive, holistic, and sociocultural perspective focusing on national, regional, state, county and local African-American health and health disparity issues leading toward developing public health interventions.","3"
"Public Health","MPH 6007","Global Public Health: A Global Perspective","Explores the issues related to the fields of medical anthropology and public health leading toward developing global health interventions.","3"
"Public Health","MPH 6008","Ethnic Health and Health Disparities","Explores the issues related to ethnic health and health disparities, leading toward developing new public health intervention programs.","3"
"Public Health","MPH 6009","Capstone Experience in Ethnic Health and Health Disparities","P: MPH 6005  , MPH 6007  , MPH 6008  ; or consent of instructor.      Integrates critical thinking concepts, research strategies, public health skills, and culturally competent training culminating in a final project.","3"
"Public Health","MPH 6010","Fundamentals of Environmental Health","EHST 6010    Effects of environment on human health with focus on rural environment. Considers water supply and wastewater disposal, water quality, solid and hazardous wastes, air quality, occupational health and safety, food protection, and vector control.","3"
"Public Health","MPH 6011","Introduction to Epidemiology","HLTH 6011    Introduces methods and concepts of epidemiologic methodology and application of epidemiology in public health.","3"
"Public Health","MPH 6013","Principles of Health Behavior","Introduces concepts of role of social factors in health and illness as well as health education/promotion. Overview of relationships between various social factors, with health outcomes. Includes theories and approaches of health education/promotion programs.","3"
"Public Health","MPH 6017","Global Public Health Study Abroad Experience","May be repeated with change of country for a maximum of 6 s.h. P: Admission to MPH or consent of instructor.      Principles of health administration and research strategies associated with global public health.","3 or 6"
"Public Health","MPH 6020","Research Methods","Synthesize material from social and behavioral sciences, biostatistics, and epidemiology to better understand health problems.","3"
"Public Health","MPH 6021","Epidemiology of Chronic Disease","P: MPH 6011  .       Epidemiologic measures, statistical methods, and quantitative models specific to chronic disease epidemiology.","3"
"Public Health","MPH 6022","Epidemiology of Infectious Disease","P: MPH 6011.      Provides concepts involved in understanding causes, transmission, and control of infectious disease as well as policies, methods, and tools employed in surveillance, detection, investigation, control, and prevention of disease outbreaks.","3"
"Public Health","MPH 6027","Mixed-Methods Research","Mixed-methods data collection and analysis, with focus on use of qualitative and quantitative software.","3"
"Public Health","MPH 6035","Interdisciplinary Rural Health","NURS 6035    Theoretical base and skills for interdisciplinary rural health practice.","3"
"Public Health","MPH 6036","Fundamentals in Agromedicine","Occupational and environmental illnesses, injuries, and prevention in agriculture (farming, fishing, and forestry).","3"
"Public Health","MPH 6040","Long Term Care Administration","Overview of delivery of long term care services with an emphasis on the knowledge and skills needed for effective leadership.","3"
"Public Health","MPH 6042","Public Health Organization and Administration","Introduces concepts of health care administration including US and international healthcare systems, healthcare delivery and care diversity, leadership and management of healthcare.","3"
"Public Health","MPH 6043","Public Health Planning and Evaluation","Introduces intervention planning, implementation, and evaluation concepts and methods that are applied in public health practice.","3"
"Public Health","MPH 6044","Principles of Health Policy","Concepts related to planning, implementing, and financing health policy initiatives for governmental public health policy development.","2"
"Public Health","MPH 6045","Strategies for Public Health Communication","Examines the communication of public health related information to public, academic, and governmental agencies. Major topics may include oral communication, written communication, and communication during public health emergencies.","2"
"Public Health","MPH 6050","Independent Study","May be repeated. May count a maximum of 6 s.h. toward degree. P: Consent of instructor and concentration advisor.      Study of topic not otherwise offered in public health curriculum or in greater depth than is possible within context of regular course.","1"
"Public Health","MPH 6051","Independent Study","May be repeated. May count a maximum of 6 s.h. toward degree. P: Consent of instructor and concentration advisor.      Study of topic not otherwise offered in public health curriculum or in greater depth than is possible within context of regular course.","2"
"Public Health","MPH 6052","Independent Study","May be repeated. May count a maximum of 6 s.h. toward degree. P: Consent of instructor and concentration advisor.      Study of topic not otherwise offered in public health curriculum or in greater depth than is possible within context of regular course.","3"
"Public Health","MPH 6250","Aging Health Policy and Equity Analysis","Contemporary perspectives on health policies affecting the health and qualities of life of older populations in a variety of settings. Investigates social determinants of health inequities and health care in older adults.","3"
"Public Health","MPH 6500","Quality Improvement in Public Health","Quality improvement consists of systematic and continuous actions that lead to measurable improvement in health care services and the health status of targeted patient/population groups. The course focuses on quality improvement and its application and importance in public health practice. At the end of this course, the student will have completed the Institute for Healthcare Improvement Basic Certification in Quality and Safety.","1"
"Public Health","MPH 6501","Grant Writing in Public Health","Focuses on grant writing in the field of community health and health behavior. Includes a completed service grant application, written by each student, on a health-related topic utilizing a recursive writing process.","1"
"Public Health","MPH 6502","Public Health Project Management","Fundamentals of project management in public health, including scope, objectives/tasks, schedule and budget.","1"
"Public Health","MPH 6600","Planning Public Health Programs","P: MPH 6013  .      Development and delivery of public health programs.","3"
"Public Health","MPH 6605","Evaluating Public Health Programs","Evaluation of public health programs, including formative, process, impact, and outcome evaluation.","3"
"Public Health","MPH 6610","Nutrition and Public Health Issues","NUTR 6610    P: Consent of instructor.      Examines science base for community nutrition, including problem identification, interpretation of nutritional data and scientific issues, public health policy, societal and health trends, and emerging legislative issues related to nutrition and public health.","3"
"Public Health","MPH 6670","Public Health Perspectives on Maternal and Child Health","Introduces students to maternal and child health (MCH), with primarily a domestic focus. Emphasis on understanding the role policies and programmatic issues play in MCH. Students will gain an understanding of key issues for MCH populations.","3"
"Public Health","MPH 6700","Health Economics","P: ECON 2113 or equivalent.      Application of economic analysis tools to the making of health care decisions at the individual, systemic, and broader policy levels.","3"
"Public Health","MPH 6702","Epidemiology Methods","P: MPH 6011  ;    P/C: BIOS 7021  ; or consent of instructor.   Explores quantitative research methods, principles and techniques necessary for designing and implementing epidemiological research.","3"
"Public Health","MPH 6800","Health Policy and Politics","Examines the health policy formation context as a component of the environment of public health administration and practice and roles of public health and healthcare professionals.","3"
"Public Health","MPH 6810","Strategic and Financial Management of Healthcare Organizations","Provides a framework for understanding strategic and financial management of healthcare organizations.","3"
"Public Health","MPH 6903","Comprehensive Field Placement","240 hour field placement. P: Consent of instructor.      Students must have substantial previous experience in public health at the professional level to be eligible for this course. Project development and demonstration of academic knowledge with learned public health core competencies in professional public health practice settings.","3"
"Public Health","MPH 6904","Introduction to Field Placement","It is recommended that the student has completed all eight MPH core courses by the time they complete this course.       Introduces the student to leaders from different healthcare entities; providing information and discussion on both field placement and career ladder opportunities in their specific healthcare domains.","1"
"Public Health","MPH 6905","Applied Field Placement","240 hour field placement. P: MPH 6904  .      Demonstration of academic knowledge with learned public health core competencies in professional public health practice settings.","2"
"Public Health","MPH 6991","MPH Professional Paper","May be repeated. Only 3 s.h. may count towards the degree. P: MPH 6000  , MPH 6002  , MPH 6011  , and MPH 6020  or consent of instructor.      Includes applied learning exercise on the implementation of public health and epidemiologic research methodology. Students develop a research proposal (6991); implement their proposal, analyze their results, and write a public health research article (6992) that is ready for submission to a peer-reviewed scientific journal.","2"
"Public Health","MPH 6992","MPH Professional Paper","May be repeated. Only 3 s.h. may count towards the degree. P: All core courses or consent of instructor.      Includes applied learning exercise on the implementation of public health and epidemiologic research methodology. Students develop a research proposal (6991); implement their proposal, analyze their results, and write a public health research article (6992) that is ready for submission to a peer-reviewed scientific journal.","1"
"Public Health","MPH 7010","Human Resource Management and Leadership for Health Administration","Provides the essential knowledge and skills for management of human resources in a health services organization and a foundation in leadership theory, skills and applications.","3"
"Public Health","MPH 7031","Topics in Public Health","May be repeated up to 6 s.h. with change of topic. P: Consent of instructor or program director.      Readings and discussion related to contemporary issues and emerging topics in public health.","1"
"Public Health","MPH 7100","Methods in Analytic Epidemiology","Examines intermediate concepts in observational epidemiologic study designs and analysis using statistics and software.","3"
"Public Health","MPH 7150","Introduction to Clinical Research","P: MPH 6702  .       Introduction to the principles and practice of clinical research with focus on ethics, regulatory requirements, design, and protocol development.","2"
"Public Health","MPH 7200","Principles of Public Health Surveillance","P: BIOS 7021  ; MPH 6011  .      Public health surveillance as a fundamental epidemiologic activity applied to infectious and non-infectious conditions affecting human populations.","3"
"Public Health","MPH 7201","Introduction to Survey Methodology","Must have completed the required research methods core course for their concentration before taking this course. P: BIOS 7021  .      Overview of principles and practices of population-based survey research, including methods, sampling designs, questionnaire development, sources of error, and analysis of survey data.","3"
"Public Health","MPH 7202","Introduction to Public Health Data Analysis","P: BIOS 7021  ; MPH 6011  .      Basic instruction in public health data analysis using core features of SAS Software.","3"
"Public Health","PUBH 7930","Environmental and Occupational Exposure Assessment","P: Admission to DrPH environmental and occupational health concentration.      Environmental and occupational exposure assessment and its role in providing information and tools for toxicology, epidemiology, and risk management applications.","3"
"Public Health","PUBH 8002","Public Health Microbiology, Water and Food Safety","P: Admission to DrPH environmental and occupational health concentration.      Evaluation and management of microorganisms that contribute to water and food safety concerns.","3"
"Public Health","PUBH 8003","Issues and Case Studies in Occupational Medicine","P: Admission to DrPH environmental and occupational health concentration.      Identification of occupational factors in the causation of disease, consideration of occupational factors in the management of disease, and measures for prevention of occupational and work-related diseases, and promotion of health in the workplace.","3"
"Public Health","PUBH 8004","Public Health Pests and Vector-Borne Diseases","P: Admission to DrPH environmental and occupational health concentration.      Identification, management, and ecology of arthropods and other disease vectors, as well as characteristics and epidemiology of diseases associated with these vectors.","3"
"Public Health","PUBH 8005","Advanced Control of Occupational Hazards","P: Admission to DrPH environmental and occupational health concentration.      Application of engineering controls to prevent and manage occupational health hazards, such as substitution of less toxic options, modification of work processes, design of local exhaust ventilation systems, proper selections and use of personal protective equipment.","3"
"Public Health","PUBH 8006","Water Supply and Wastewater Treatment","P: Admission to DrPH environmental and occupational health concentration.      Overview of methodologies to protect water quality, with an emphasis on fundamental principles.  Topics may include settling, biosolids/sludge treatment, filtration and disinfection.","3"
"Public Health","PUBH 8007","Advanced Industrial Hygiene Applications","P: Admission to DrPH environmental and occupational health concentration.      Evaluation, prevention and management of occupational hazards (industrial hygiene).","3"
"Public Health","PUBH 8020","Organizational Theory and Leadership","P: Admission to the DrPH health policy, administration and leadership concentration.      Organizational theories and healthcare organization evolution.","3"
"Public Health","PUBH 8025","Quantitative Research Methods","3 lecture and 1 lab hour per week.  P: Admission to the DrPH environmental and occupational health or health policy administration and leadership concentration.      Application, analysis and evaluation of advanced quantitative methods used in public health research.","4"
"Public Health","PUBH 8100","Applied Environmental and Industrial Hygiene","P: Admission to DrPH environmental and occupational health concentration.      Case studies of exposures to chemical and physical hazards in both occupational and non-occupational settings will be conducted, to include exposure evaluation, exposure controls and environmental sampling to document conditions.","3"
"Public Health","PUBH 8110","Emerging Issues in Environmental and Occupational Health","P: Admission to DrPH environmental and occupational health concentration.      Impact of macro-level trends, such as corporate globalization, immigration patterns, and technological development on the environment, focusing on the relationship between the environmental infrastructure and environmental media, such as air, water and waste.","3"
"Public Health","PUBH 8120","Introduction to Environmental and Occupational Health Law","P: Admission to DrPH environmental and occupational health concentration.      Examination of US and international environmental and occupational health legislation, such as the Clean Air Act, Clean Water Act, and Occupational Safety and Health Act.","3"
"Public Health","PUBH 8125","Environmental and Occupational Epidemiology","P: Admission to DrPH environmental and occupational health concentration.      Application of epidemiological principles to the study of occupational and general environmental exposures to contaminants. Type of exposures, outcomes and related epidemiological topics. Examination of data sources and management, sampling strategies, tracing and follow-up procedures, and monitoring and surveillance.","3"
"Public Health","PUBH 8130","Strategic Planning, Theory and Practice","P: Admission to the DrPH health policy, administration and leadership concentration.      Strategic management theory and application in healthcare settings.","3"
"Public Health","PUBH 8134","Financial Planning and Management","P: MPH 6700  or equivalent; managerial course or equivalent; statistics or econometrics course or equivalent.       Appraisal of financial planning and management principles and strategies as applied in health system settings.","3"
"Public Health","PUBH 8150","Environmental Risk Communication","P: Admission to DrPH environmental and occupational health concentration.      Focus upon the improvement of skills in effectively communicating environmental risk information to diverse groups and promoting appropriate risk prevention/control strategies.","3"
"Special Education","SPED 6011","Integrating Technology into Special Education","P: 3 s.h. technology course.      Strategies for integration of technology into instruction, record keeping, management, productivity, communication, and professional development of special educators.","3"
"Special Education","SPED 6012","Assessment in Special Education","Includes a required field experience.       Selection, administration, interpretation, and application of assessment instruments and strategies in special education. Examines research, legislative mandates, and American Psychological Association standards.","3"
"Special Education","SPED 6014","Positive Behavior Intervention and Support","Includes a required field experience.        Applying principles of positive behavior intervention and support to address individual, classroom, and school-wide behavior challenges.","3"
"Special Education","SPED 6015","Facilitating Systems Change through Collaboration and Co-Teaching","Includes a required field experience.        Principles and effective practices of collaboration and co-teaching to induce systemic change on behalf of students with exceptionalities.","3"
"Special Education","SPED 6020","Curriculum Development and Program Planning in Special Education for Students with Intellectual Disabilities","Includes a required field experience.        Planning, delivering, monitoring, and modifying instructional programs for students with intellectual disabilities.","3"
"Special Education","SPED 6021","Instructing Students with Intellectual Disabilities","Includes a required field experience.  P: SPED 6020  .      Planning, delivering, monitoring, and modifying instructional programs. Emphasis on applying research literature to acquire and refine best practices in instruction of students who have intellectual disabilities.","3"
"Special Education","SPED 6022","Instructing Students with Learning Disabilities","Includes a required field experience.  P: SPED 6025  .      Planning, delivering, monitoring, and modifying instructional programs. Emphasis on applying research literature to acquire and refine best practices in instruction of students with learning disabilities.","3"
"Special Education","SPED 6023","Instructing Students with Behavioral/Emotional Disorders","Includes a required field experience.  P: SPED 6027  .      Evaluation and modification of instructional and management programs for students and youth with behavioral/emotional disorders. Examines research and demonstration of best practices through classroom teaching.","3"
"Special Education","SPED 6024","MAT Internship","P: TCHR 6010  , TCHR 6011  .      Supervised teaching in special education settings with emphasis on reflective decision-making.","9"
"Special Education","SPED 6025","Curriculum Development and Program Planning for Students with Learning Disabilities","Includes a required field experience.        Planning, delivering, monitoring and modifying instructional programs for students with learning disabilities.","3"
"Special Education","SPED 6027","Curriculum Development and Program Planning for Students with Behavior Disabilities","Includes a required field experience.        Planning, delivering, monitoring and modifying instructional programs for students with behavior disabilities.","3"
