"subject","course_code","course_name","description","credits"
"Applied Music","MUSC 6224","Graduate Applied Music (Percussion)","One one-hour lesson weekly. May be repeated for credit. P: Graduate status in music and consent of instructor.      Applied music study with appropriate instrument or voice.","4"
"Applied Music","MUSC 6231","Graduate Applied Music (Jazz)","One thirty-minute lesson weekly. May be repeated for credit. P: Graduate status in music and consent of instructor.       Applied music study with appropriate instrument or voice.","1"
"Applied Music","MUSC 6232","Graduate Applied Music (Jazz)","One one-hour lesson weekly. May be repeated for credit. P: Graduate status in music and consent of instructor.      Applied music study with appropriate instrument or voice.","2"
"Applied Music","MUSC 6233","Graduate Applied Music (Jazz)","One one-hour lesson weekly. May be repeated for credit. P: Graduate status in music and consent of instructor.      Applied music study with appropriate instrument or voice.","3"
"Applied Music","MUSC 6234","Graduate Applied Music (Jazz)","One one-hour lesson weekly. May be repeated for credit. P: Graduate status in music and consent of instructor.      Applied music study with appropriate instrument or voice.","4"
"Applied Music","MUSC 6995","Graduate Recital","May be repeated for credit. P:  Acceptance into a degree or certificate program that requires a recital for graduation; prior approval by the requisite applied music faculty committee is necessary before the recital may be scheduled.      Public performance of musical compositions appropriate to the student’s specific degree or certificate program.","2"
"Art and Design","ART 6000","Readings in Art","P: Graduate standing in the School of Art and Design.      Explores ideas, theories, emergent issues, and trends in art through selected readings in art and philosophy. Discussion and analysis of reading as applied to students’ personal aesthetic and studio production.","3"
"Art and Design","ART 6501","Glass I","6 studio hours per week.        An introduction to the fundamental skills used in hot and cold glass working. Emphasis on safety and movement in the glass studio.","3"
"Art and Design","ART 6502","Glass II","6 studio hours per week.  P: ART 6501  .      Technical development using glass as a contemporary art material. Exploration of hot-glass methods that utilize multiple-part forming and assembly processes.","3"
"Art and Design","ART 6503","Glass III","6 studio hours per week.  P: ART 6502  .      Self-guided study of glass art focusing on individual thematic development and creation of a cohesive body of work.","3"
"Art and Design","ART 6504","Glass IV","6 studio hours per week.  P: ART 6503  .      Advanced studio with an emphasis on the technical refinement and consistency of a student’s work and its clear communication of the content beyond aesthetics.","3"
"Art and Design","ART 6990","Art and Design Pedagogy","An introduction to art and design pedagogy to prepare for college-level teaching.","3"
"Art Education","ART 5323","Art in the Secondary School","P: Acceptance in MAT program.      Art education philosophy, methodology, media, and techniques for teaching junior and senior high school students.","3"
"Art Education","ART 5810","Arts and Crafts for Elementary Teachers","Workshop course Not open to ART majors.       Drawing, painting, printmaking, sculpture, and craft processes suitable for elementary school classes.","3"
"Art Education","ART 5851","Art in the Elementary School","P: Acceptance in MAT program.      Art education philosophy, methodology, materials, processes, and specific projects for elementary classes.","3"
"Art Education","ART 5860","Classroom Participation in Art","P: Acceptance in MAT program.      Classroom practice in the teaching of art and discussion of procedures used.","1"
"Art Education","ART 5870","Computers in Art Education","P: Acceptance in MAT program.      Entry-level basic computer operations applicable to the K-12 art education classroom.","1"
"Art Education","ART 6024","MAT Internship","P: TCHR 6010  , TCHR 6011  .      Supervised teaching in the art classroom with emphasis on reflective decision-making.","9"
"Art Education","ART 6800","History and Philosophy of Art Education","P: Admission to Graduate School and MAEd in art program; consent of instructor.      History of art instruction in American schools, philosophies of art education, past and present, the influences on current and past art instruction, and recent trends in art education.","3"
"Art Education","ART 6801","Supervision of Art Education","P: Admission to Graduate School and MAEd in art program.      Duties of art supervisor, philosophies of supervision as applied to art, curriculum development in art, personnel practices and staff development in art supervision, public relations, preparation of art budgets, and legal aspects of art supervision.","3"
"Art Education","ART 6804","Current Topics in Art Education","P: Admission to the Graduate School and MAEd in art program; consent of instructor.      Issues relevant to the discipline of art education will be explored through critical analysis of readings and review of contemporary methods.","3"
"Art Education","ART 6805","Interdisciplinary Topics in Visual Art Education","P: Admission to the Graduate School and MAEd in art program; consent of instructor.      Interdisciplinary art education across the life span for diverse populations.","3"
"Art Education","ART 6898","Research in Art Education","P: Admission to Graduate School and MAEd in art program.      History, significant findings, practical applications and implications, recent studies, areas needing further research, and research procedures in art education.","3"
"Art Education","ART 6899","Technical Writing in Art Education","P: ART 6898  .       Explores technical writing in the field of art education. Includes the development of papers for publication in the field.","3"
"Art History","ARTH 6908","Research Methods in Art History","Readings and research in theory and methodology of art history.","3"
"Art History","ARTH 6909","Seminar in Art History","May be repeated with different instructor. May count for a maximum of 6 s.h. Theory, methodological studies, and reading in history of art.","3"
"Art History","ARTH 6912","African Art","Traditional and contemporary art of west and central Africa.","3"
"Art History","ARTH 6913","Asian Art","Significant traditions in art of India, China, and Japan from antiquity to modern times.","3"
"Art History","ARTH 6916","Art of India","Significant art periods, traditions, and artists of ancient and modern India.","3"
"Art History","ARTH 6920","Nineteenth Century Painting","Neo-classicism, romanticism, realism, impressionism, postimpressionism, and related trends of nineteenth century.","3"
"Art History","ARTH 6925","African American Art","Survey of African American art in North America from Colonial Period through the twentieth century. Examines works of art and craft in different media. Explores various cultural impacts upon art production.","3"
"Art History","ARTH 6930","Italian Renaissance Art: 1300-1500","Significant artists and art theories of Renaissance Italy.","3"
"Art History","ARTH 6935","Italian Baroque Art: 1600-1700","Significant artists and art theories of Baroque Italy.","3"
"Art History","ARTH 6940","Twentieth-Century Modern Art: 1900-1950","European and North American art from first half of twentieth century.","3"
"Art History","ARTH 6942","Twentieth-Century Modern Art: 1950-2000","European and North American art from second half of twentieth century.","3"
"Art History","ARTH 6944","Studies in Contemporary Art: Post 1960s","ART 5981   Critical look at art since the 1960s that deals with the political economy of representation.","3"
"Art History","ARTH 6946","Studies in Contemporary Art: Post 1980s","Critical look at art since the 1980s that has been engaged in a representation of a political economy.","3"
"Art History","ARTH 6948","Art in the United States","Visual culture in the US from the colonial times to the present.","3"
"Art History","ARTH 6951","History of Architecture","Architectural history in the West from prehistory to 21st century.","3"
"Art History","ARTH 6952","Byzantine Art and Architecture","Art and architecture of the Byzantine Empire (ca. 300-1500) and artistic realms of its cultural influence (Armenia, Bulgaria, Georgia, Italy, Romania, Russia, Serbia, Turkey, and the United States).","3"
"Art History","ARTH 6960","Art and Power in Mesoamerica","Chronological survey of major Mesoamerican cultures and how visual arts they produced reflect aspects of religious and political power.","3"
"Art History","ARTH 6961","Native North American Art and Ritual","Overview of major native North American cultures and how visual arts created by native artists were part of their ritual, religious, and everyday lives. Covers cultural changes attributed to European impact.","3"
"Art History","ARTH 6970","History of Nineteenth- and Twentieth-Century Design","Major artists and movements in history of textile, ceramic, metal, wood, and graphic design.","3"
"Art History","ARTH 6980","Ceramic History of North Carolina and the Southeastern United States","NC ceramics from colonial times to present.","3"
"Wood Design","ART 5312","Wood Design Studio IX","P: For undergraduate students: ART 2304 or consent of instructor.      Original research in wood design.","3"
"Wood Design Banked Courses","ART 6302","Problems in Wood Design","To be taken in sequence.","3"
"Wood Design Banked Courses","ART 6312","Problems in Wood Design","To be taken in sequence.","3"
"Wood Design Banked Courses","ART 6322","Problems in Wood Design","To be taken in sequence.","3"
"Wood Design Banked Courses","ART 6332","Problems in Wood Design","To be taken in sequence.","3"
"Wood Design Banked Courses","ART 6342","Problems in Wood Design","To be taken in sequence.","3"
"Wood Design Banked Courses","ART 6352","Problems in Wood Design","To be taken in sequence.","3"
"Wood Design Banked Courses","ART 6362","Problems in Wood Design","To be taken in sequence.","3"
"Wood Design Banked Courses","ART 6372","Problems in Wood Design","To be taken in sequence.","3"
"Education","EDUC 7411","Special Topics","May be repeated for credit. Focus on special topics in education.","2"
"Education","EDUC 7412","Special Topics","May be repeated for credit. Focus on special topics in education.","3"
"Education","EDUC 7420","Advanced Educational Statistics","P: EDUC 7001  or consent of instructor.      Major types of quantitative models and their practical application to data analysis in educational research. Emphasis on appropriateness of types of models for different research problems, use of models as a basis for data interpretation, and management of data analysis projects.","3"
"Education","EDUC 7430","Qualitative Research in Education","Field project required.       Major types of research methods and techniques and their applicability to clarification and understanding of educational problems. Field project develops basic and advanced skills for conducting qualitative research in educational settings.","3"
"Education","EDUC 7440","Applied Educational Research","P: EDUC 6480  or consent of instructor.      Instructional systems based strategies and methodology for identifying and using research findings in school practice. Emphasis on critical evaluation of current educational trends. Use of research information considered an advanced form of behavioral technology.","3"
"Elementary Education","ELEM 5306","Social Studies in the Elementary School","Social studies objectives implemented by study of programs, strategies, and materials.","3"
"Elementary Education","ELEM 5990","Special Topics in Elementary Education","May be repeated for a maximum of 6 s.h. with change of topic. P: Consent of instructor.       Selected topics in elementary education. Topics vary depending on student interest and current issues in elementary education.","3"
"Elementary Education","ELEM 6001","Educational Research in the Classroom II","3 lecture hours per week are required.  P: ELEM 6005  .      Implementation and analysis of a classroom-based educational research project in elementary education.","3"
"Elementary Education","ELEM 6005","Educational Research in the Classroom I","3 lecture hours per week.  P: Admission to the Elementary Education, MAEd  .      Development of a research proposal based on trends and issues in elementary education.","3"
"Elementary Education","ELEM 6010","Teaching the Integrated Language Arts in the Elementary School","P: TCHR 6010  , TCHR 6011  ; or consent of instructor.      Nature and role of language arts and the integration throughout the elementary curriculum.","3"
"Elementary Education","ELEM 6024","MAT Internship","P: TCHR 6010  , TCHR 6011  .      Supervised teaching in elementary school with emphasis on reflective decision-making.","9"
"Elementary Education","ELEM 6200","Leading Curriculum Revision and Implementation","P: Admission to MAEd in ELEM; or consent of instructor.      Examines the structure of elementary school curricula and the role of teachers as leaders in curricular decisions.","3"
"Elementary Education","ELEM 6350","Advanced Content Pedagogy in Elementary Education","3 lecture hours per week.        Examination of advanced pedagogical skills and innovative methods in teaching and learning in the content areas in elementary education.","3"
"Elementary Education","ELEM 6400","Advanced Assessment and Teaching in the Elementary Grades","P: Admission to MAEd in ELEM; or consent of instructor.      Applies societal, cultural, and educational factors to problems of assessment and teaching. Design, application, and evaluation of teaching models and assessment.","3"
"Elementary Education","ELEM 6406","The Teaching of Social Studies in the Elementary Grades","P: Admission to MAEd in ELEM; or consent of instructor.      Examines current research, standards, curricula and strategies relevant to elementary social studies instruction.","3"
"Elementary Education","ELEM 6408","Collaborating, Teaming, and Leading in the Elementary School","Leadership, team functioning, development, and teaming practices, and collaboration in elementary schools. Role of teacher as member and leader of planning and evaluation teams to improve learning in schools.","3"
"Elementary Education","ELEM 6410","Concepts and Principles of Early Childhood Education","Concepts, principles, trends, and current programs in early childhood content.","3"
"Elementary Education","ELEM 6412","Emerging Literacy","P: Admission to MAEd in ELEM; or consent of instructor.      Examination of literacy as an emerging process with emphasis on critically reviewing sociocultural factors influencing literacy and designing appropriate strategies to enhance young children’s literacy education.","3"
"Elementary Education","ELEM 6488","Advanced Language Arts in the Elementary School","P: Admission to MAEd in ELEM; or consent of instructor.      Provides advanced analysis of language arts instruction and assessment, as well as professional development and critical reflection for elementary educators.","3"
"Elementary Education","ELEM 6500","Management and Problem-Solving in the Elementary School","P: Admission to MAEd in ELEM; or consent of instructor.      Recognizing and forming plans to address management problems in the elementary school.","3"
"Elementary Education","ELEM 6550","Leadership and Communication Skills in Education","ADED 6550    Teacher leadership, communication, and reflective practice in schools. Skill development enhances communication and collaboration with families, students, and educational professionals. Addresses organizational challenges and facilitates positive change.","3"
"Elementary Education","ELEM 6600","Implications of Poverty for Learning and Development","Examines the cognitive, social, and emotional implications of poverty on children and families.","3"
"Elementary Education","ELEM 6625","Responsive Curriculum for Children in Poverty","Integration of a standards-based curriculum with evidence-based interventions in poverty contexts.","3"
"Elementary Education","ELEM 6650","Families and Communities in Poverty","Examines family and community characteristics, needs, and resources for students and families living in poverty. Recognizing there are a variety of types of families and that some students have none at all, this course will look at a variety of living arrangements including traditional families, foster placements, group homes, and homelessness.","3"
"Elementary Education","ELEM 6675","Evaluative and Educative Implications for Teaching Children in Poverty","Examines the role and structure of multiple assessment protocols for educators working with students in poverty.","3"
"Elementary Education","ELEM 6700","Teachers as Leaders in Elementary Education","3 lecture hours per week.        Examination of the nature, context, and practice of teacher leadership in the classroom, school and in the profession.","3"
"Elementary Education","ELEM 6710","Mentoring, Coaching, and Instructional Leadership","Examines the theoretical foundations and practical applications of mentoring, coaching, and instructional leadership for teachership.","3"
"Elementary Education","ELEM 6720","Teacher Leadership in Professional Learning","Examines models of professional learning and the critical role of teacher leadership in designing and delivering effective professional learning opportunities.","3"
"Elementary Education","ELEM 6730","Teacher Advocacy and Education Policy","Examines the knowledge and skills teacher leaders need to understand and navigate educational policies at the local, state, and national levels.","3"
"Elementary Education","ELEM 6740","Teacher Leadership in Education","Examines the theoretical foundations, key principles, and best practices that shape effective teacher leadership.","3"
"Elementary Education","ELEM 7000","Thesis","May be repeated. May count maximum of 6 s.h.","1-6"
"English","ENGL 5230","Southern Regional Literature","Southern writing representing attitudes of region. Confined to literary genres.","3"
"English","ENGL 5330","Studies in Women’s Literature","May be repeated for credit by graduate students.       Writings of women within context of feminist scholarship and criticism. Focus on genre within literary period or specific national/international context.","3"
"English","ENGL 5350","Special Studies in Film","May be repeated for credit by graduate students.       Aspects of world film literature. Topics to be announced by instructor.","3"
"English","ENGL 6000","Critical Writing in English Studies","P:  3 s.h. graduate credit or consent of instructor.      Explores academic writing conventions.","3"
"English","ENGL 6151","Topics in British Literature Before 1800","May be repeated for a maximum of 9 s.h. with change of topic.       Advanced study of authors, periods, subjects, and genres within, as well as approaches to, British literature before 1800.","3"
"English","ENGL 6155","Topics in British Literature After 1800","May be repeated for a maximum of 9 s.h. with change of topic.       Advanced study of authors, periods, subjects, and genres within, as well as approaches to, British literature after 1800.","3"
"English","ENGL 6220","Topics in American Literature Before 1865","May be repeated for a maximum of 9 s.h. with change of topic.       Advanced study of authors, periods, subjects, and genres within, as well as approaches to, American literature before 1865.","3"
"English","ENGL 6250","Topics in American Literature After 1865","May be repeated for a maximum of 9 s.h. with change of topic.       Advanced study of authors, periods, subjects, and genres within, as well as approaches to, American literature after 1865.","3"
"English","ENGL 6270","Literature and the Environment","Literature in English examined in terms of the relationship between imagination, culture, and nature.","3"
"English","ENGL 6330","Studies in Latinx Literatures","Explores twentieth century Latinx literatures.","3"
"English","ENGL 6340","Ethnic American Literature","Writers who have contributed to multicultural American literature, including African-American, Jewish-American, Native-American, Hispanic-American, and Asian-American.","3"
"English","ENGL 6345","Jewish Literature","Examines Jewish literature, nineteenth century to the present.","3"
"English","ENGL 6350","Studies in Native American Literature","Explores Native American literatures of twentieth century.","3"
"English","ENGL 6360","World Literature Written in English","Comparative literatures. Focus on post colonial writers. Emphasis on anglophone texts from Africa, the Caribbean, South and Central America, Asia, and Pacific Rim.","3"
"English","ENGL 6370","Caribbean Literature","Critical examination of Caribbean literature.","3"
"English","ENGL 6375","Middle Eastern Literature","Examines Middle Eastern literature, in English, with a focus on recent and transnational texts.","3"
"English","ENGL 6380","Studies in African Literature","Explores African literature written in English in twentieth century.","3"
"English","ENGL 6390","Advanced Studies of Science Fiction and Fantasy","Historical trends, problems, and contemporary movements in science fiction and fantasy.","3"
"English","ENGL 6420","Studies in Asian American Literature","Explores Asian American literature.","3"
"English","ENGL 6450","Studies in World Indigenous Literatures","Study of literature (including film) in English produced by Indigenous or Fourth World writers and creators around the world.","3"
"English","ENGL 6460","Studies in African American Literature","ENGL 5360   Explores African American literature.","3"
"English","ENGL 6470","Literary Theory","Application of theory into the study of literature.","3"
"English","ENGL 6475","Multicultural Women’s Literatures","Examination of how nationality, gender, sexual orientation, race, class, and cultural location cut across women’s definition of themselves, their personal and public lives, and how these overall dynamics affect their literary creations.","3"
"English","ENGL 6480","LGBTQ+ Theories and Literatures","Critical queer theory, and, to a lesser extent, LGBTQ+ studies will be put into conversation with LGBTQ+ and queer literature including, but not limited to fiction, non-fiction, and young adult fiction.","3"
"English","ENGL 6485","Disability Studies Theories and Literatures","Exploration of the field of disability studies, including the social construction of disability and the lived experience of people with disabilities via literature and area-specific readings.","3"
"English","ENGL 6490","Multicultural and Transnational Poetry","Examination of American poets who write about multicultural experiences. Includes an exploration of the nature of public and private voices, the uses of form, and how history, culture, and identity are shaped through poetry.","3"
"English","ENGL 6495","Transnational Sinophone Cinema","Examination of films by directors from Greater China (Republic of China, Taiwan, and Hong Kong). Focuses on the Chinese identity, in its national, regional, and transnational contexts, as it intersects with issues such as race, ethnicity, class, gender, sexuality, and religion.","3"
"English","ENGL 6505","Linguistic and Cultural History of the English Language","Examines the emergence of English from Germanic language, its changes through fifteen centuries, and the development of the many spoken varieties around the world today.","3"
"English","ENGL 6515","Advanced Studies in Children’s Literature","Sources of literature for children. Emphasis on excellence and suitability. Attention given to trends, problems, and recent research.","3"
"English","ENGL 6525","Language and Society","Language in relation to culture and society.","3"
"English","ENGL 6526","The Structure of English: Phonology and Morphology","Contemporary phonological and morphological components of the English language.","3"
"English","ENGL 6527","The Structure of English: Syntax and Semantics","Contemporary syntactic and semantic components of the English language.","3"
"English","ENGL 6528","TESOL: Theories and Principles","Current theories and principles in teaching English to speakers of other languages (TESOL).","3"
"English","ENGL 6530","Descriptive Linguistics","ENGL 7530   Modern linguistic theory and its application to all levels of language documentation, description and analysis.","3"
"English","ENGL 6531","TESOL: Methods","Approaches and methods for teaching English to speakers of other languages (TESOL).","3"
"English","ENGL 6535","Principles of Language Testing","Principles and methods of performance and standardized language test design, implementation, and interpretation.","3"
"English","ENGL 6625","Teaching Composition: Theory and Practice","Composition theory and its applications to college writing instruction.","3"
"English","ENGL 6680","Writing Systems of the World","Examines writing systems and their relationship to the larger human phenomenon of spoken language.","3"
"English","ENGL 6700","Information Design and Production","Study of current research and theory for the design of information. Includes an exploration of how verbal and visual elements work together for the effective communication of information to intended audiences.","3"
"English","ENGL 6702","Research Methods in Technical and Professional Communication","Formerly ENGL 7701   Investigation of research problems and research practices in technical and professional communication.","3"
