"subject","course_code","course_name","description","credits"
"Accompanying","MUSC 6457","Advanced Vocal Accompanying","May be repeated for credit.       Extensive study of techniques correlated with practical experience of performing with vocal majors. Accompanying of vocal music major in half recital in one of two semesters.","2"
"Accompanying","MUSC 6467","Advanced Vocal Accompanying","May be repeated for credit.       Extensive study of techniques correlated with practical experience of performing with vocal majors. Accompanying of vocal music major in half recital in one of two semesters.","2"
"Accompanying","MUSC 6557","Advanced Instrumental Accompanying/Chamber Music","May be repeated for credit.       Extensive study of techniques correlated with practical experience of performing with instrumental majors. Accompanying of instrumental music major in half recital in one semester.","2"
"Accompanying","MUSC 6567","Advanced Instrumental Accompanying/Chamber Music","May be repeated for credit.       Extensive study of techniques correlated with practical experience of performing with instrumental majors. Accompanying of instrumental music major in half recital in one semester.","2"
"Accompanying","MUSC 6993","Graduate Recital","May be repeated. P: Acceptance to the MM degree; prior approval by appropriate faculty necessary before recital may be scheduled.      Public performance of musical compositions appropriate to the MM degree (collaborative piano concentration).","1"
"Accompanying","MUSC 6994","Graduate Recital","May be repeated for credit. P: Acceptance to the MM degree; prior approval by appropriate faculty necessary before recital may be scheduled.      Public performance of musical compositions appropriate to MM degree (collaborative piano concentration).","1"
"Accounting","ACCT 6221","Principles of Accounting and Finance","Generation and flow of financial information through the accounting system as well as financial control, capital budgeting, time value of money, ratio analysis, and valuation.","3"
"Accounting","ACCT 6231","Principles of Business","Functions of business from organizational structure and human resource management to marketing behavior.","3"
"Accounting","ACCT 6241","Financial and Managerial Accounting","May not count toward the MSA. Generation and flow of financial information through accounting system and its uses by management in decision-making process.","3"
"Accounting","ACCT 6301","Fraud Examination","May not count as an elective for MBA or MSA degrees if credit has been earned in ACCT 3101 or an equivalent course.        Basic understanding of fraud prevention, detection concepts, and examination techniques.","3"
"Accounting","ACCT 6521","Accounting for Decision Making","May not count for MSA students with an undergraduate degree in accounting.  P: ACCT 6241  .      Managerial accounting, cost theories, and applications and their effect on decision making.","3"
"Accounting","ACCT 6611","Auditing","P/C: ACCT 6631  .  Auditing standards and procedures and their relation to principles and systems of internal control of business operations.","3"
"Accounting","ACCT 6621","Intermediate Financial Accounting Theory","P: ACCT 6241  .      Principles and concepts underlying the compilation of financial statements along with financial reporting problems and contemporary financial accounting issues.","6"
"Accounting","ACCT 6631","Advanced Cost and Systems","P/C: ACCT 6241  .  Types of cost accounting for planning, control, and product cost combined with the study of the accounting system.","3"
"Accounting","ACCT 6641","Advanced and Governmental Accounting","P: ACCT 6621  .      Business combinations, other advanced accounting topics and the principles underlying the compilation/presentation of governmental and nonprofit financial statements.","3"
"Accounting","ACCT 6701","Regulation","P: ACCT 6891  .      Regulatory issues confronting accountants and AICPA standards for professional responsibility.","3"
"Accounting","ACCT 6801","Accounting Theory","P: ACCT 6241  .      Accounting principles, practices, and procedures of complex business enterprises.","3"
"Accounting","ACCT 6831","Taxation and Business Decisions","May not count toward the BSA/MSA. P: ACCT 6241  ; FINA 6144  .      Analysis of how tax issues affect business decisions.","3"
"Accounting","ACCT 6891","Federal Income Taxation","General income tax theory and applications to problems encountered by individuals and businesses. Compliance, planning, and research.","3"
"Accounting","ACCT 6901","Advanced Federal Taxation","P: ACCT 6891  .      Income tax issues encountered by corporations, partnerships, and families. Includes gift and estate taxation, research and compliance procedures, and planning for maximization of after-tax benefits for multiple entities.","3"
"Accounting","ACCT 6911","Research in Taxation","Federal taxation at research level. Research for individuals and corporations. Introduction to estates and trusts.","3"
"Accounting","ACCT 6921","Advanced Taxation of Partnerships","P: ACCT 6891  .      Federal taxation of partnerships, S-corporations, and limited liability companies.","3"
"Accounting","ACCT 6931","Advanced Taxation of Estates","P: ACCT 6891  .      Federal taxation of estates, trusts, and gifts.","3"
"Accounting","ACCT 6951","Auditing Seminar","P: ACCT 6611  .      Conceptual framework of independent auditing. Emphasis on development of theory, methodology, standards, and practice.","3"
"Accounting","ACCT 6961","Information Technology Auditing","P: ACCT 6611  .      Fundamental concepts of the information technology (IT) security audit and control process in government, financial, and healthcare industries.","3"
"Accounting","ACCT 6971","Corporate Governance and Accounting Ethics","Fundamental concepts of corporate governance and accounting ethics.","3"
"Accounting","ACCT 6981","The Professional Accounting Environment","P: ACCT 6611  , ACCT 6891  .      Advanced accounting topics, the audit, and contemporary issues and problems. Emphasis on cost accounting, international accounting, business combinations, taxation, and practical application.","3"
"Accounting","ACCT 6991","Advanced Topics in Accounting","May be repeated a maximum of 9 s.h. with a change of topic and consent of department chair or MSA program coordinator.        Investigation of specific problems in accounting.","3"
"Addictions and Rehabilitation","ADRE 6000","Medical and Psychosocial Aspects of Disability","Functional capacities of individuals with disabilities, impact of disability on individual, and personal and social adjustment to life.","3"
"Addictions and Rehabilitation","ADRE 6001","Medical and Psychosocial Aspects of Disability","Functional capacities of individuals with disabilities, impact of disability on individual, and personal and social adjustment to life.","0"
"Addictions and Rehabilitation","ADRE 6010","Introduction to Clinical, Addictions, and Rehabilitation Counseling","History and philosophy of the counseling profession, including credentialing, ethical standards and counselor role and function in clinical, substance abuse, and rehabilitation settings.","3"
"Addictions and Rehabilitation","ADRE 6050","Ethical and Legal Aspects in Clinical, Addictions, and Rehabilitation Counseling","P: Admission to MS in clinical counseling or MS in rehabilitation and career counseling, or consent of instructor.      Ethical standards, legal issues, and decision making in counseling.","3"
"Addictions and Rehabilitation","ADRE 6100","Occupational Analysis and Career Counseling","REHB 5100   P: Consent of instructor.      Current occupational, vocational, career counseling, and career development theories and practices related to persons with and without disabilities across the life-span.","3"
"Addictions and Rehabilitation","ADRE 6200","Psychosocial Aspects of Disability","Social and psychological issues related to physical and mental disability. Identification of adjustment problems and design of appropriate rehabilitation responses.","3"
"Addictions and Rehabilitation","ADRE 6250","Diagnosis and Treatment of Mental and Emotional Disorders","P: Admission to MS in clinical counseling or MS in rehabilitation and career counseling, or consent of instructor.      Diagnostic and treatment practices for counseling individuals with mental disorders.","3"
"Addictions and Rehabilitation","ADRE 6300","Clinical, Addictions, and Rehabilitation Counseling Theories","P: Admission to MS in clinical counseling or MS in rehabilitation and career counseling, or consent of instructor.      Theories and perspectives of clinical, addictions, rehabilitation and counseling/psychotherapy.","3"
"Addictions and Rehabilitation","ADRE 6310","Prepracticum in Clinical, Addictions, and Rehabilitation Counseling","P: Admission to MS in clinical counseling or MS in rehabilitation and career counseling, or consent of instructor.      In class practice of counseling skills and techniques, assessment practices, treatment/rehabilitation plans, professional issues, standards, and ethics.","3"
"Addictions and Rehabilitation","ADRE 6320","Family Treatment in Substance Abuse Rehabilitation","HDFS 6320    P: ADRE 6703  or consent of instructor.      Rehabilitation and treatment strategies. Family intervention strategies, family counseling, and treatment of adult children of addicted parents. Emphasis on relationships of family, substance abuse, and major physical and mental disabilities.","3"
"Addictions and Rehabilitation","ADRE 6330","Clinical and Addictions Counseling","P: Admission to MS in clinical counseling or consent of instructor; ADRE 6703  .      Theory and practice for counseling people with mental health and addiction disorders, including issues related to assessment, family, co-occurring disorders,special populations, stress management, criminal justice system, and relapse prevention.","3"
"Addictions and Rehabilitation","ADRE 6340","Human Growth and Development in Clinical, Addictions and Rehabilitation Counseling","P: Admission to MS in clinical counseling or MS in rehabilitation and career counseling, or consent of instructor.      Addresses the nature and needs of persons at all developmental levels across the lifespan within various multicultural contexts.","3"
"Addictions and Rehabilitation","ADRE 6350","Clinical, Addictions, and Rehabilitation Group Counseling","P: Admission to MS in clinical counseling or MS in rehabilitation and career counseling, or consent of instructor; ADRE 6300  , ADRE 6310  , ADRE 6703  .      Didactic and experiential group counseling processes for individuals with mental health, addiction, and/or physical disorders, and vocational issues.","3"
"Addictions and Rehabilitation","ADRE 6351","Personal Growth Group Lab","10 lab sessions.  P: Admission to MS in clinical counseling or MS in rehabilitation and career counseling, or consent of instructor.      Direct student experience in a personal growth group.","1"
"Addictions and Rehabilitation","ADRE 6360","Practicum in Clinical, Addictions, and Rehabilitation Counseling","Minimum of 8 hours per week in applied setting. P: Admission to MS in clinical counseling or MS in rehabilitation and career counseling, or consent of instructor; ADRE 6300  , ADRE 6310  .  C: ADRE 6361  .    Counseling clients with clinical mental health issues, addictions, adjustment to disability, educational and/or career planning.","3"
"Addictions and Rehabilitation","ADRE 6361","Practicum in Clinical, Addictions, and Rehabilitation Counseling Lab","Minimum of 8 hours per week in applied field-site setting. P: Admission to MS in clinical counseling or MS in rehabilitation and career counseling, or consent of instructor; ADRE 6300  , ADRE 6310  ;  C: ADRE 6360  .    Counseling of clients with problems of personal/social adjustment, substance abuse, adjustment to disability, educational and/or career planning in an applied setting.","1"
"Addictions and Rehabilitation","ADRE 6370","Multicultural Issues in Clinical, Addictions, and Rehabilitation Counseling","P: Admission to MS in clinical counseling or MS in rehabilitation and career counseling, or consent of instructor.      Awareness, knowledge, and skills to counsel persons from culturally diverse backgrounds.","3"
"Addictions and Rehabilitation","ADRE 6375","Military and Trauma Counseling","Prepares graduate-level students to work with active duty service members, veterans, and their families who have experienced trauma. Focuses on the medical, psychosocial, vocational, mental health, and cultural aspects of active duty service members, veterans, and their families.","3"
"Addictions and Rehabilitation","ADRE 6376","Civilian Trauma Counseling","Focuses on providing effective counseling services for civilians (non-military/veteran persons) who have been exposed to a traumatic event, such as victims of abuse, natural disasters, pandemics, sexual assault, and mass violence at schools and universities.","3"
"Addictions and Rehabilitation","ADRE 6380","Career Counseling in Clinical, Addictions, and Rehabilitation Counseling","P: Consent of instructor.      Concepts of social, psychological, theoretical, and learning needs of career counseling and development.","3"
"Addictions and Rehabilitation","ADRE 6400","Introduction to Vocational Evaluation and Career Assessment","REHB 5400   History, theories and philosophies of vocational evaluation to include credentialing, program accreditation, ethics, and the role and function of the vocational evaluator in various social service settings.","3"
"Addictions and Rehabilitation","ADRE 6401","Assessment in Clinical, Addictions, and Rehabilitation Counseling","P: Admission to MS in clinical counseling or MS in rehabilitation and career counseling, or consent of instructor.      Principles of standardized psychological, clinical mental health, addiction, vocational, and educational tests and inventories.","3"
"Addictions and Rehabilitation","ADRE 6501","Independent Study in Clinical, Addictions, and Rehabilitation Counseling","May be repeated for a maximum of 6 s.h. P: Admission to MS in clinical counseling or MS in rehabilitation and career counseling, or consent of instructor.      Advanced independent study for MS research project, under supervision of faculty.","1"
"Addictions and Rehabilitation","ADRE 6521","Directed Research in Clinical, Addictions, and Rehabilitation Counseling","May be repeated for a maximum of 3 s.h. P: Admission to MS in clinical counseling or MS in rehabilitation and career counseling, or consent of instructor.      Research in a particular counseling/rehabilitation problem based on student’s special interests and needs.","1"
"Addictions and Rehabilitation","ADRE 6522","Directed Readings in Rehabilitation","No class meetings; hours for instructor conferences arranged. Consent of instructor. Intensive reading on particular rehabilitation problem based on student’s special interests and needs.","1"
"Addictions and Rehabilitation","ADRE 6523","Directed Readings in Rehabilitation","No class meetings; hours for instructor conferences arranged. Consent of instructor. Intensive reading on particular rehabilitation problem based on student’s special interests and needs.","1"
"Addictions and Rehabilitation","ADRE 6550","Research in Clinical, Addictions, and Rehabilitation Counseling","P: Admission to MS in clinical counseling or MS in rehabilitation and career counseling, or consent of instructor.      Examination of historical, correlation, causal-comparative, descriptive, and experimental research designs to prepare students to evaluate research.","3"
"Addictions and Rehabilitation","ADRE 6561","Master of Science Research Project","P: ADRE 6550  or consent of instructor.      Formulation of lab project, case study, experimental study, or library research project that demonstrates principles and procedures of recognizing and formulating problems of scientific, professional, and clinical importance in rehabilitation.","3"
"Addictions and Rehabilitation","ADRE 6703","Foundations of Addictions and Clinical Counseling","Examination of psychoactive drugs of abuse including their impact on society, drug regulation, and psychopharmacology. Emphasis placed on clinical counseling, prevention, and treatment.","3"
"Addictions and Rehabilitation","ADRE 6793","Treatment in Addictions and Clinical Counseling","P: Admission to Clinical Counseling, MS or Addictions Prevention and Treatment Studies Certificate, or consent of instructor; and ADRE 6703  .      Evidence-based strategies and models for treating individuals addicted to substances and behaviors, such as pathological gambling, compulsive sex, and binge eating, as well as co-occurring clinical mental health issues.","3"
"Addictions and Rehabilitation","ADRE 6795","Prevention of Drug and Behavioral Addictions","P: Admission to a graduate rehabilitation program or consent of instructor; and ADRE 6703  .       Current evidence-based models will be applied to the prevention of substance and behavioral addictions.","3"
"Addictions and Rehabilitation","ADRE 6796","Contemporary Issues for Addictions","P: Admission to a graduate rehabilitation program or consent of instructor; and ADRE 6703  .       In-depth exploration of current topics in the field of substance and behavioral addictions.","3"
"Addictions and Rehabilitation","ADRE 6799","Independent Study in Alcohol/Drug Abuse Addiction","P: ADRE 6795  or consent of instructor.      Etiology, epidemiology, treatment, rehabilitation, intervention, or prevention.","3"
"Addictions and Rehabilitation","ADRE 6895","Internship in Vocational Evaluation","May be taken for a maximum of 12 s. h. P: Consent of graduate director.      Field placement specific to vocational evaluation which can be substituted for ADRE 6991  .","3-12"
"Addictions and Rehabilitation","ADRE 6991","Internship in Clinical, Addictions, and Rehabilitation Counseling","Must be repeated for a minimum of 12 s.h. P: Consent of DARS graduate director.      Field-site placement in a professional clinical mental health, addictions, and/or rehabilitation counseling program during student’s last semester.","3"
"Addictions and Rehabilitation","ADRE 7000","Thesis","May be repeated. May count maximum of 6 s.h. P: Consent of instructor.","1-6"
"Addictions and Rehabilitation","ADRE 7001","Thesis: Summer Research","May be repeated. No credit may count toward degree. Students conducting thesis research may only register for this course during the summer. P: Consent of instructor.","1"
"Addictions and Rehabilitation","ADRE 7340","Advanced Clinical Counseling Theories and Techniques","P: ADRE 6300  , ADRE 6310  or equivalent; or consent of instructor.      Counseling theories utilized with people with disabilities, such as cognitive behavioral counseling, transactional analysis, and gestalt therapy. Counseling techniques and strategies such as stress management skill training, anger management, self-esteem building, conflict management, dream work, and alternative and complementary therapies.","3"
"Addictions and Rehabilitation","ADRE 7404","Resource Development in Rehabilitation Counseling and Administration","P: Consent of instructor.      Development of research or service grants, contract proposals, and project implementation and closure.","3"
"Addictions and Rehabilitation","ADRE 7601","Rehabilitation Administration and Leadership","P: Consent of instructor.      Provides overview of management and leadership theory for rehabilitation service delivery organizations.","3"
"Addictions and Rehabilitation","ADRE 7610","Employee Assistance Programs","P: Consent of instructor.      Theory and practice of employee assistance programs. Organization, structure, and professional helping role.","3"
"Addictions and Rehabilitation","ADRE 8050","Ethical and Legal Issues in Counselor Education and Supervision","P: ADRE 6050  or consent of instructor.      Issues of professionalism and ethical practice related to counselor education, supervision, administration, consultation, and practice.","3"
"Addictions and Rehabilitation","ADRE 8210","Advanced Pedagogy in Rehabilitation Counseling","P: Consent of instructor.      Prepares professionals to teach in higher education settings.","3"
"Addictions and Rehabilitation","ADRE 8350","Advanced Group Counseling in Rehabilitation","P: ADRE 6350  or equivalent or consent of instructor.      Advanced group counseling techniques and skills with people in rehabilitation settings. Includes experiential component.","3"
"Addictions and Rehabilitation","ADRE 8360","Advanced Practicum","P: ADRE 6360  or consent of instructor.      Experience in clinical counseling, counselor education, or administration with individual and/or triadic supervision.","3"
"Addictions and Rehabilitation","ADRE 8370","Advanced Multicultural Ethics and Leadership in Counseling","P: ADRE 6370  or consent of instructor.      Multicultural theories, experiences, and activities to develop advanced cultural awareness, ethics, knowledge, and skills to work as professionals and leaders with individuals, groups, and organizations from diverse backgrounds.","3"
"Addictions and Rehabilitation","ADRE 8380","Rehabilitation Counseling Supervision","P: Consent of instructor.      Current knowledge in theoretical foundations and applied models of counselor/clinical supervision within a rehabilitation counseling context. Doctoral students develop skills in roles of supervisor-teacher, supervisor-counselor, and supervisor-consultant. Simulated counselor-supervision experiences and engagement in experiential training by supervising several master’s-level practicum and/or internship supervisees.","3"
"Addictions and Rehabilitation","ADRE 8410","Seminar in Vocational Evaluation Systems Design","P: ADRE 6400  or equivalent; consent of instructor.      Examines vocational assessment and vocational systems, including construction, standardization, and administration. Reviews service delivery systems that utilize vocational evaluation/assessment instruments. Analysis of effective service and system matches.","3"
"Addictions and Rehabilitation","ADRE 8420","Advanced Assessment and Evaluation","P: ADRE 6401  , ADRE 6550  ; or consent of instructor.      Advanced study of evaluation procedures and methods necessary to analyze and assess individuals and/or programs.","3"
"Addictions and Rehabilitation","ADRE 8531","Independent Study","P: Consent of instructor.      Intensive reading on a particular area of rehabilitation or administration. Hours for instructor conferences arranged individually with student.","1"
"Addictions and Rehabilitation","ADRE 8532","Independent Study","P: Consent of instructor.      Intensive reading on a particular area of rehabilitation or administration. Hours for instructor conferences arranged individually with student.","1"
"Addictions and Rehabilitation","ADRE 8533","Independent Study","P: Consent of instructor.      Intensive reading on a particular area of rehabilitation or administration. Hours for instructor conferences arranged individually with student.","1"
"Addictions and Rehabilitation","ADRE 8550","Advanced Research in Rehabilitation","P: Consent of instructor.      Prepares professionals to study and evaluate professional practice.","3"
"Addictions and Rehabilitation","ADRE 8630","Theory and Design of Rehabilitation Programs","P: ADRE 7601  or equivalent or consent of instructor.      Theory, philosophy, and administrative processes behind design and operation of different rehabilitation service delivery programs. Approaches to evaluating and improving program effectiveness.","3"
"Addictions and Rehabilitation","ADRE 8710","Substance Abuse Seminar","P: ADRE 6330  , ADRE 6793  , ADRE 6796  ; or consent of instructor.      Covers contemporary and controversial issues in substance abuse field. Explores opposing viewpoints from leading health care professionals, social scientists, and social commentators. Develops critical thinking skills, including debates, literature review, and class discussion. Examines several major issues facing the substance abuse field.","3"
"Addictions and Rehabilitation","ADRE 8810","Doctoral Seminar in Rehabilitation Counseling","P: Consent of instructor.      Forum to review, discuss, write, and develop research on a variety of current topics in rehabilitation counseling and/or administration.","1-4"
"Addictions and Rehabilitation","ADRE 8991","Advanced Internship","P: Consent of graduate director.      Includes a minimum of 600 hours of supervised experiences in clinical practice, supervision, research, and/or teaching.","3"
"Addictions and Rehabilitation","ADRE 8992","Advanced Internship","P: Consent of graduate director.      Includes a minimum of 600 hours of supervised experiences in clinical practice, supervision, research, and/or teaching.","3"
"Addictions and Rehabilitation","ADRE 8993","Advanced Internship","P: Consent of graduate director.      Includes a minimum of 600 hours of supervised experiences in clinical practice, supervision, research, and/or teaching.","3"
"Addictions and Rehabilitation","ADRE 8994","Advanced Internship","P: Consent of graduate director.      Includes a minimum of 600 hours of supervised experiences in clinical practice, supervision, research, and/or teaching.","3"
"Addictions and Rehabilitation","ADRE 9000","Dissertation","May be repeated. May count maximum of 18 s.h. toward degree. P: Consent of instructor.       Original research on a significant aspect of behavioral health.","1-12"
"Addictions and Rehabilitation","ADRE 9001","Dissertation Summer Research","May be repeated. No credit may count toward degree. Students conducting dissertation research may only register for the course during summer. P: Consent of instructor.","1"
