"school","subject","course_code","course_name","credits","description"
"School of Education","Graduate Education Courses","EDUC-E 534","Inquiry in Math and Science","2-3 cr.","Students must be admitted to the Elementary Transition to Teaching Program. This course will focus on developing teaching competencies in science and math instructional methodologies. Science methods will foster students' scientific literacy and develop the evidence-based science instruction approaches. Math methods will emphasize teaching math through problem-solving strategies."
"School of Education","Graduate Education Courses","EDUC-E 535","Elementary School Curriculum","3 cr.","Social, economic, and educational forces influencing changes in the curriculum of the elementary school; observation and study of the curriculum and methods of evaluating it."
"School of Education","Graduate Education Courses","EDUC-E 536","Supervision of Elementary School Instruction","3 cr.","Modern concepts of supervision and the evolutionary processes through which they have emerged. Supervisory work of the principal, general supervisor, and supervisor or consultant. Study of group processes in a democratic school system."
"School of Education","Graduate Education Courses","EDUC-E 543","Advanced Study in the Teaching of Mathematics in the Elementary Schools","3 cr.","Designed to help the experienced teacher improve the teaching of mathematics. Opportunities will be provided for individual and group study of content, methodology, and instructional materials for modern mathematics programs."
"School of Education","Graduate Education Courses","EDUC-E 545","Advanced Study in the Teaching of Reading in the Elementary Schools","3 cr.","For experienced teachers. Review of developmental reading program in the elementary school, use of reading in various curriculum areas, appraisal of reading abilities, and techniques and materials for individualized instruction."
"School of Education","Graduate Education Courses","EDUC-E 547","Advanced Study in the Teaching of Social Studies in the Elementary Schools","3 cr.","For experienced teachers. Goals and functions of social studies and underlying principles that influence the teaching of social studies; content, resources, and methodology that facilitate the implementation of these."
"School of Education","Graduate Education Courses","EDUC-E 548","Advanced Study in the Teaching of Science in the Elementary Schools","3 cr.","Helps experienced teachers gain proficiency in the teaching of science in the elementary school. Characteristics of good elementary school science programs."
"School of Education","Graduate Education Courses","EDUC-E 549","Advanced Study in the Teaching of Language Arts in the Elementary Schools","3 cr.","Helps experienced teachers gain further insight into the development of the English language and how best to teach language arts. Emphasizes basic communication skills and significant trends and materials."
"School of Education","Graduate Education Courses","EDUC-E 553","The Teacher and Elementary School Organization","3 cr.","The structure and organization of the elementary school and the role of the teacher in its effective operation. For classroom teachers."
"School of Education","Graduate Education Courses","EDUC-G 504","Counseling Theory and Techniques II: Behavior and Family Systems","3 cr.","Analysis of major behavioral and family counseling theories emphasizing didactic and experimental activities designed to model application of processes, procedures, and techniques of behavior and family approaches to professional practice."
"School of Education","Graduate Education Courses","EDUC-G 507","Lifestyle and Career Development","3 cr.","Lifestyle and career development includes such areas as vocational choice theory, relationship between career choice and lifestyle, sources of occupational and educational information, approaches to career decision-making processes, and career development exploration techniques."
"School of Education","Graduate Education Courses","EDUC-H 520","Education and Social Issues","3 cr.","P: Graduate Standing. Identification and analysis of major problems set for education by the pluralistic culture of American society."
"School of Education","Graduate Education Courses","EDUC-J 500","Instruction in the Context of Curriculum","3 cr.","Extends concepts introduced in undergraduate teacher preparation. Topics include conceptions and definitions of curriculum and instruction; and their impact on social contexts, learning theories, and schooling practices. Elementary and secondary contexts are studied."
"School of Education","Graduate Education Courses","EDUC-J 501","Strategies for Teaching, Learning, and Curriculum","3 cr.","This course is required for the collaborative MS in Teaching, Learning, and Curriculum. Participants learn about research-based principles of learning and use them to design, deliver, and adapt instruction and curriculum for individuals with diverse learning needs.Â  Will focus on the interplay between teaching, learning and curriculum for applications across dynamic community contexts."
"School of Education","Graduate Education Courses","EDUC-J 630","Curriculum Theory and Practice","3 cr.","Explores fundamental dimensions of curriculum theory, such as: the social construction of knowledge, curriculum as cultural mindset, political reality, and scholarly discourse. Examines varied ideological orientations to curriculum studies. Introduces basic concepts of curriculum design and provides opportunities for curriculum development."
"School of Education","Graduate Education Courses","EDUC-K 505","Introduction to Special Education for Graduate Students","3 cr.","P: Graduate standing or consent of instructor. Basic special education principles for graduate students with no previous course work in special education."
"School of Education","Graduate Education Courses","EDUC-K 510","Assistive Technology in Special Education","3 cr.","Prepares future teachers with the knowledge required to integrate assistive technology into curricula for students with mild to moderate disabilities."
"School of Education","Graduate Education Courses","EDUC-K 535","Assessment/Remediation of Mildly Handicapped I","3 cr.","Emphasizes the collection and use of formal and informal assessment information for designing the content of individual educational plans for handicapped children in such academic areas as reading and mathematics."
"School of Education","Graduate Education Courses","EDUC-K 548","Families, School and Society","3 cr.","The course focuses on the family as a system and discusses the impact of disabilities on the daily lives of family members. Historical, legal and ethical perspectives on family involvement and empowerment are explored. Approaches for providing services to families with members who are developmentally disabled, chronically ill, at risk or who have other types of impairments also are presented."
"School of Education","Graduate Education Courses","EDUC-K 553","Classroom Management","3 cr.","Surveys principles of behavior management as they pertain to educational environments. Students will learn how to define, observe, measure, record, and change academic and social behavior."
"School of Education","Graduate Education Courses","EDUC-K 563","Diagnosis and Remediation of Learning Disabilities","3 cr.","This course is designed to promote understanding of what constitutes a learning disability, how classroom teachers can accommodate, adapt and modify assignments to meet the needs of students with special needs, and what the presence of a learning disability means for identified students, their families, and their teachers.Â  Causes of learning disabilities, the development of students with learning disabilities, assessment of learning disabilities, and planning appropriate instruction and behavior interventions for students with learning disabilities will be addressed."
"School of Education","Graduate Education Courses","EDUC-K 565","Collaboration & Service Delivery","3 cr.","Reviews methods of implementing service delivery systems; consulting with professionals and parents; designing in-service training programs; and developing referral systems, curricular and personnel resources, and evaluation techniques used in special education programs."
"School of Education","Graduate Education Courses","EDUC-M 550","Practicum: (variable title)","1-8 cr.","Grade: S or F. Teaching or experience in an accredited school, normally in Indiana. Credit will be commensurate with time spent in the instructional setting.Â Â"
"School of Education","Graduate Education Courses","EDUC-P 503","Introduction to Research","3 cr.","Methods and procedures in educational research."
"School of Education","Graduate Education Courses","EDUC-P 507","Assessment in Schools","3 cr.","P: Graduate Standing. 


Introductory assessment course for teachers and school administrators. Topics include principles of assessment, formal and informal classroom assessment instruments and methods, formative and summative assessment, interpretation and use of standardized test results, social and political issues in assessment, use of student data bases in schools."
"School of Education","Graduate Education Courses","EDUC-P 510","Psychology in Teaching","3 cr.","Basic study of psychological concepts and phenomena in teaching. An analysis of representative problems and the teacherâs assumptions about human behavior and its development. This course is intended for those working toward the masterâs degree and who currently are or are planning to be classroom teachers."
"School of Education","Graduate Education Courses","EDUC-P 514","Life Span Development: Birth to Death","3 cr.","A survey course of human development from infancy through old age, emphasizing the life span perspective of development. Classical stage theorists, current popular conceptions, major research findings, and educational implications for all life stages from birth to death."
"School of Education","Graduate Education Courses","EDUC-P 570","Behavior Problems in the Public Schools","3 cr.","For teachers, administrators, psychologists, case workers, and others concerned with the adjustment of children in school. Recognition of behavioral symptoms indicative of the need for special attention; role and methods used in dealing with behavioral problem children."
"School of Education","Graduate Education Courses","EDUC-Q 528","Demonstration and Field Strategies in Science","1-6 cr.","Identification, selection, design, implementation, and evaluation of demonstrations and field trips. Strategies in science for elementary, middle school, junior high, and secondary school teachers."
"School of Education","Graduate Education Courses","EDUC-Q 540","Teaching Environmental Education","3 cr.","For elementary and secondary teachers. Basic principles of environmental/conservation education stressed in grades K-12. Methods and techniques for integrating these principles into existing curricula. Designed for the development and evaluation of new interdisciplinary teaching materials."
"School of Education","Graduate Education Courses","EDUC-S 503","Secondary School Education","3 cr.","Designed to provide an overview for the teacher of the basic theories underlying the secondary school curriculum, as well as an examination of the subject areas, problems, trends, challenges for the future and significant research in the field."
"School of Education","Graduate Education Courses","EDUC-S 504","Introduction to Stem Teaching","3 cr.","An introduction to the foundational principles necessary to create a student-centered, inquiry-based learning environment. Students will identify and evaluate their preconceptions about classroom teaching and reflect on the following: Why do we teach STEM? What does quality STEM instruction look like? What are the implicit and explicit messages conveyed by the teacher?"
"School of Education","Graduate Education Courses","EDUC-S 505","The Junior High and Middle School","3 cr.","Role of the junior high school and middle school in American education. Total program: philosophy, functions, curriculum, guidance, activities, personnel, and administration."
"School of Education","Graduate Education Courses","EDUC-S 507","The Teacher and Secondary School Organization","3 cr.","For teachers and administrators. Functions of school personnel, organization of professional and lay people for a more effective school program, professional leadership, lay participation, and effective personnel organization."
"School of Education","Graduate Education Courses","EDUC-S 514","Advanced Study in the Teaching of Reading in the Junior High and Secondary School","3 cr.","The developmental reading program in junior high and secondary schools; use of reading in various curriculum areas, appraisal of reading abilities, and techniques and materials for helping reluctant and retarded readers."
"School of Education","Graduate Education Courses","EDUC-S 530","Junior High and Middle School Curriculum","3 cr.","The educational program designed for the junior high and middle school. Functions, organization, planning, and evaluation of the junior high and middle school curriculum in specific areas."
"School of Education","Graduate Education Courses","MATH-T 620","Topics in Topology/Geometry","3 cr.","Required course for the Graduate Certificate in Math-Online collaborative. Students will develop graduate-level knowledge in essential concepts of Topology/Geometry including topics in Euclidean and non-Euclidean Geometry, Point set topology, Differential Topology, Differential Geometry, and other topics in Topology/Geometry."
"School of Education","Graduate Education Courses","EDUC-W 505","Multimedia in the Classroom","3 cr.","Intended to equip teachers and administrators with confidence when using the myriad of technology tools available for educators. Skills covered include: scanning, digital camera photography, video capture, creating slide shows, developing web pages, and audio capture."
"School of Education","Graduate Education Courses","EDUC-W 590","Individual Research in Computer Education","1-6 cr.","P: EDUC-Y 510 (Action Research 1) Individual study or research for students exploring issues in educational technology. To be arranged with a technology faculty member in advance of registration. A one- or two-page written proposal should be submitted to the instructor during the first week of the term specifying the scope of the project, project activities, meeting times, completion date, and student product(s). Ordinarily W590 will not be used for the study of material taught in a regularly scheduled course."
"School of Education","Graduate Education Courses","EDUC-X 501","Critical Reading in Content Areas","3 cr.","P: Graduate Standing 


Analyzes and applies to reading various theories and models of thinking; presents teaching/learning strategies for developing critical reading; evaluates instructional materials and methodologies designed to foster critical reading."
"School of Education","Graduate Education Courses","EDUC-X 504","Diagnosis of Reading Difficulties in the Classroom","3 cr.","P: Graduate standing. Treats the theory, correlates, instruments, and techniques of diagnosing reading difficulties in the classroom."
"School of Education","Graduate Education Courses","EDUC-X 530","Topical Workshop in Reading","3 cr.","Individual and group study of special topics in the field of reading. Means for improving the teaching of reading. One credit hour is offered for each week of full-time work."
"School of Education","Graduate Education Courses","EDUC-Y 520","Strategies for Educational Inquiry","3 cr.","Methods and procedures in educational research. The primary purpose of this course is to introduce students to the basics of educational research, principally as it occurs in and is applied to practical, classroom settings. Course design will include lecture and discussions, independent study, individual conferences/ tutorials with the instructor, and student-led presentations related to proposed research projects."
"School of Education","Graduate Education Courses","EDUC-Y 595","Educational Inquiry: Authentic Application","3 cr.","P: Graduate standing.  Application of methods and procedures in educational research. The primary purpose of this course is to apply educational inquiry strategies and skills learned in EDUC-Y 520 Strategies for Educational Inquiry. Course design will include lecture and discussions, independent study, individual conferences/tutorials with the instructor, and student-led presentations related to completed research projects."
"School of Education","Graduate Education Courses","EDUC-J 500","Instruction in Context of Curriculum","3 cr.","Online Collaborative Course. First course for the Master's degree in Curriculum & Instruction. Extends concepts introduced in undergraduate teacher preparation. Topics include conceptions and definitions of curriculum and instruction and their impact on social contexts, learning theories, and schooling practices. Elementary and secondary contexts are studied."
"School of Education","Graduate Education Courses","EDUC-G 504","Counseling Theory and Techniques II","3 cr.","Analysis of major behavioral and family counseling theories emphasizing didactic and experimental activities designed to model application of process, procedures, and techniques of behavior and family approaches to professional practice."
"School of Education","Graduate Education Courses","EDUC-G 507","Lifestyle and Career Development","3 cr.","Lifestyle and career development includes such areas as vocational choice theory, relationship between career choice and lifestyle, sources of occupational and educational information, approaches to career decision-making processes, and career development exploration techniques."
"School of Humanities and Social Sciences","Communication and Culture","CMCL-C 545","Communication Pedagogy","3 cr.","Online Collaborative Course. Focuses on critical, theoretical, philosophical and strategic approaches to problems of pedagogy in communication and culture."
"School of Humanities and Social Sciences","Communication and Culture","CMCL-C 592","Advanced Health Communication","3 cr.","Online Collaborative Course. A course designed to teach communication skills and practices related to health care, by examining health care communication theory. Topics covered range across communication levels (interpersonal, intrapersonal, group, organizational, mass media & mediated communication) within a variety of health care contexts."
"School of Humanities and Social Sciences","Communication and Culture","CMCL-C 594","Communication and Conflict Management in Organizations","3 cr.","Online Collaborative Course. This seminar-format course examines the communication exchanges that facilitate conflict management within organizational contexts. Specific attention is focused on negotiation and mediation; however the communication of alternative means of conflict and dispute resolution are also discussed. In addition, students are introduced to methods for assessing conflict interaction in organizations."
"School of Humanities and Social Sciences","Communication and Culture","CMCL-C 606","Media Criticism","3 cr.","Online Collaborative Course. Study of the main schools and methods of media criticism."
"School of Humanities and Social Sciences","Communication and Culture","CMCL-C 610","Identity and Difference","3 cr.","Online Collaborative Course. Political, social, and cultural dimensions of identity and difference. Interrogates the production of marginal and dominant identities (e.g. racial, sexual, colonial) and the emergence of new forms of identification."
"School of Humanities and Social Sciences","Communication and Theatre","COMM-C 510","Health Provider-Consumer Communication","3 cr.","Online Collaborative Course. This course is designed to teach communication skills and practices related to health care talk, by examining transactional communication within health care contexts. Topics covered in this course focus directly upon interpersonal dialogue between health care providers and patients."
"School of Humanities and Social Sciences","Communication and Theatre","COMM-C 528","Group Communication and Organizations","3 cr.","Online Collaborative Course. This seminar-format course examines the ways in which informal groups and communication networks facilitate a variety of organizational processes (i.e. socialization, diffusion of innovation). Emphasis is placed on developing theoretical understanding of informal groups in organizations as well as on methodological issues involved in studying communication networks in organizations."
"School of Humanities and Social Sciences","Communication and Theatre","COMM-C 544","Advanced Relational Communication","3 cr.","Online Collaborative Course. An introductory course in interpersonal communication. Applications of communication theory/research in such areas as relational culture and relationship development. Includes a scholarly project on a real relationship, and applications of research to areas such as pedagogy and couple/family therapy."
"School of Humanities and Social Sciences","Communication and Theatre","COMM-C 582","Advanced Intercultural Communication","3 cr.","Online Collaborative Course. Exploration of issues related to the intercultural communication process. Consideration of the role of social, cultural, and historical contexts in intercultural interactions. Examination of the relationship between culture and communication from the socio-psychological, interpretive, and critical perspectives."
"School of Humanities and Social Sciences","Communication and Theatre","COMM-C 593","Family Communication","3 cr.","Online Collaborative Course. Applications of theory and research on the role of communication in creating and maintaining marriages/committed couples and families."
"School of Humanities and Social Sciences","Speech","SPCH-S 500","Introduction to Communication Theory","3 cr.","Online Collaborative Course. Bibliographical resources, methods of research and professional writing in speech."
"School of Humanities and Social Sciences","Speech","SPCH-S 627","Studies in Cross-Cultural Communication","3 cr.","Online Collaborative Course. The study of cross-cultural communication in theory and practice."
"School of Humanities and Social Sciences","Criminal Justice and Homeland Security","CJHS-J 519","Probation and Parole","3 cr.","This course examines the historical and contemporary use of corrections in the community with a special focus on the empirical evidence of the effectiveness of community-based practices. The issues facing community corrections will be explored and critically discussed."
"School of Humanities and Social Sciences","Criminal Justice and Homeland Security","CJHS-J 594","Introduction to Research Methods","3 cr.","Research methodology in criminal justice. Research design, scientific methods, quantitative/qualitative applications, ethical questions, and the role of the criminal justice researcher."
"School of Humanities and Social Sciences","Criminal Justice","CJUS-P 501","Proseminar: Criminal Justice I","3 cr.","Online Collaborative Course. A pro-seminar to provide an intensive introduction to the basic areas of Criminal Justice."
"School of Humanities and Social Sciences","Criminal Justice","CJUS-P 502","Proseminar: Criminal Justice II","3 cr.","Online Collaborative Course. Theories of crime and delinquency."
"School of Humanities and Social Sciences","Criminal Justice","CJUS-P 512","Corrections","3 cr.","Online Collaborative Course. Reviews historical and philosophical bases of correctional system and examines components of system (community corrections, jails and prisons). Focuses on the structure and functions of the corrections system with particular attention to the role of broader social forces on the development and operation of the system."
"School of Humanities and Social Sciences","Criminal Justice","CJUS-P 515","Police in Society","3 cr.","Online Collaborative Course. Covers the bases and impacts of recent changes in U.S. policing, particularly with respect to community-oriented policing. Changes are analyzed in terms of the organizational and political contexts in which they occur as well as from historical and cross-cultural perspectives."
"School of Humanities and Social Sciences","Criminal Justice","CJUS-P 594","Introduction to Research Methods","3 cr.","Online Collaborative Course. Research methodology in criminal justice. Research design, scientific methods, quantitative/qualitative applications, ethical questions, and the role of the criminal justice researcher."
"School of Humanities and Social Sciences","Criminal Justice","CJUS-P 595","Data Analysis in Criminal Justice","3 cr.","Online Collaborative Course. Data analysis applied to criminal justice data, including measurement, tables, graphs, probability, nonparametric statics, matrix algebra, correlation and regression and tests of significance."
"School of Humanities and Social Sciences","Pubic and Environmental Affairs","SPEA-J 502","Research Methods in Criminal Justice and Public Policy","3 cr.","Online Collaborative Course. This course examines research techniques necessary for systematic analysis of the criminal justice and public safety systems, offenders' behavior, crime trends, public safety issues and program effectiveness. The course requires that students actively pursue such techniques as conducting interviews, coding data, and designing studies."
