"school","subject","course_code","course_name","credits","description"
"School of Nursing","Graduate Nursing Courses","NURS-L 671","Financial Management","3 cr.","This course is designed to inform nurses of the concepts and principles related to budget preparation and fiscal management of a nursing unit or division. Constructs to be examined include the following: methods of obtaining personnel input, estimating costs, and cost justification."
"School of Nursing","Graduate Nursing Courses","NURS-N 502","Nursing Theory","3 cr.","This course focuses on evaluating the factors and issues influencing the development of theory in nursing. Theoretical terminology and criteria for the evaluation of theories are examined. Linkages applied between theory, practice, and research are explored."
"School of Nursing","Graduate Nursing Courses","NURS-N 504","Leadership for Advanced Nursing Practice","3 cr.","This course is designed to address organizational and leadership knowledge and skills required to advance health outcomes and influence policy. Key leadership issues and challenges affecting all advanced nursing practice roles will be examined within the context of developing leadership and advocacy skills."
"School of Nursing","Graduate Nursing Courses","NURS-N 610","Advanced Healthcare Quality and Safety Concepts","3-4 cr.","This course is based on a practice analysis of healthcare quality and safety professionals. It is designed to build on earlier courses in the MSN curriculum. Major course topics include organizational leadership; regulatory, accreditation, and external recognition; staff education and training; healthcare analytics; advanced performance improvement; and patient safety."
"School of Nursing","Graduate Nursing Courses","NURS-N 611","Advanced Healthcare Leadership Concepts","2 cr.","This course is based on a practice analysis of advanced healthcare leadership concepts. Major course topics include advancing Leadership and Management, Innovation, Healthcare Environment, Program Evaluation and Research, Regulatory Issues, and Population Health."
"School of Nursing","Graduate Nursing Courses","NURS-P 505","Population Health","4 cr.","This course is an overview of population health practices addressing the prioritized healthcare needs of populations, emphasizing vulnerable populations and social determinants of health, focusing on improving access and quality of care. An introduction to population health, clinical prevention/health promotions, current clinical practices, and health systems/policy will also be explored."
"School of Nursing","Graduate Nursing Courses","NURS-R 500","Nursing Research","3 cr.","This course provides a survey of research in nursing, including critique of research literature, research designs, sampling, data collection and measurement strategies, relation of research and theory, development of researchable problems, and theory utilization."
"School of Nursing","Graduate Nursing Courses","NURS-R 505","Measurement and Data Analysis","3 cr.","This course analyzes principles and application of data analysis, descriptive, inferential, and multivariate statistics. Considers the research purpose and phenomenon under study as determinants of measurement techniques and data analysis. The purpose, assumptions, and limitations of statistics will be presented. Tools and techniques for data presentation and analysis will be utilized. Introductory Item Response Theory will be explored. These topics will be considered from the perspective of research in nursing and health care."
"School of Nursing","Graduate Nursing Courses","NURS-R 590","Scholarly Project","3 cr.","This course is a guided experience in identifying a researchable nursing problem and in developing and implementing a research proposal."
"School of Nursing","Graduate Nursing Courses","NURS-T 615","Curriculum in Nursing","3 cr.","This course is designed for persons who are or will be engaged in teaching within nursing education settings. The primary focus is the process of curriculum development; philosophical, social, political, economic, and professional issues that need to be considered in planning curricula, evaluating existing curricula, and changing curricula are examined."
"School of Nursing","Graduate Nursing Courses","NURS-T 617","Evaluation in Nursing","3 cr.","This course integrates concepts of assessment and evaluation into a nursing framework. Students analyze assessment/evaluation concepts, models, and frameworks for applicability for students, faculty, curricula, and programs."
"School of Nursing","Graduate Nursing Courses","NURS-T 619","Computer Technologies for Nurse Educators","3 cr.","This course provides nurse educators an opportunity to acquire knowledge and skills for using computer technologies to support the teaching/learning process. Emphasis is given to theoretical frameworks that guide the selection, use, and integration of computer technologies in nursing education programs."
"School of Nursing","Graduate Nursing Courses","NURS-T 670","Teaching in Nursing","3 cr.","This course provides seminar and guided experiences in teaching of nursing, including planning, developing, implementing, and evaluating classroom and clinical instruction."
"School of Nursing","Graduate Nursing Courses","NURS-T 675","Nursing Elective","3 cr.","This course is an intensive study and discussion of a specific topic of current interest in the theory and/or practice of nursing education."
"School of Nursing","Graduate Nursing Courses","NURS-T 679","Nursing Education Practicum","3 cr.","A practicum experience designed for application, demonstration and synthesis of theory and competencies related to the role of nurse educator.Â  Learning experiences are planned and negotiated to meet individual learning goals in the context of preceptor supervised experiences."
"School of Nursing","Graduate Nursing Courses","NURS-Y 510","Advanced Practice Nursing Concepts I","3 cr.","Analyzes selected nursing clinical concepts and related research with a focus on practice, ethics, professional role development, human diversity and social issues as well as health promotion and disease prevention. Relationship of concepts to advanced practice models is explored.Â"
"School of Nursing","Graduate Nursing Courses","NURS-Y 515","Advanced Pathophysiology Across the Lifespan","3 cr.","P: Acceptance to MSN.   This course provides advanced knowledge of pathophysiology as the foundation for nursing management in the health care of adults. (Instructor consent required)"
"School of Nursing","Graduate Nursing Courses","NURS-Y 520","Advanced Practice Concepts 2","3 cr.","This course analyzes selected nursing concepts and related research with a focus on health care policy, organization of health care delivery systems, health care financing and health care economics and the impact of quality and safety on these concepts. Relationship of concepts to advanced practice models is explored."
"School of Nursing","Graduate Nursing Courses","NURS-Y 535","Dynamics of Family Health Care","3 cr.","This course provides students with opportunities to study families within the community context.Â  Consideration is given to theories of family functioning and roles in family health care, using family assessment tools and other nursing intervention strategies. (Admission to the FNP program required)"
"School of Nursing","Graduate Nursing Courses","NURS-Y 612","Advanced Pharmacology Across the Lifespan","3 cr.","P: Acceptance to MSN. This course focuses on pharmaceutics, pharmacokinestics, pharmacodynamics, pharmacoeconomics, and pharmacotherapeutic decision making for advanced practice nursing. This course builds on and advances understanding of anatomy, physiology, pathophysiology, physical assessment, microbiology, andÂ  pharmacology. Additionally, it emphasizes the history and foundational concepts related toÂ  pharmacotherapeutics, application of pharmacotherapeutic principles, and synthesis of pharmacotherapeutics for advanced practice nursing. (Instructor consent required)"
"School of Nursing","Graduate Nursing Courses","NURS-Y 620","Advanced Primary Care and Office Management Procedures","3 cr.","This course introduces students to advanced practice concepts and procedures related to the care of clients in the primary care setting. In addition, students are introduced to documentation and professional relationship-building skills necessary for advanced practice nurses (APNs) in the primary care setting. (Admission to the FNP program required)"
"School of Sciences","Graduate Science Courses","BIOL-T 570","Evolution","3 cr.","Online Collaborative Course. Provides a rigorous exploration of the theory of evolution; the conceptual core of biology. Topics include origins and history of life: the interplay of heredity and environment in shaping adaptations; molecular, behavioral, and social evolution; patterns of speciation, extinction, and their consequences; methods of inferring evolutionary relationships among organisms."
"School of Sciences","Graduate Science Courses","BIOL-T 574","Immunology","3 cr.","Online Collaborative Course. This course will introduce graduate students to immunology, focusing upon cells, molecules and mechanisms operating in the normal immune system and then assess the dysfunction associated with diseases and immune disorders."
"School of Sciences","Graduate Science Courses","BIOL-T 582","Advanced Field Zoology","3 cr.","Online Collaborative Course. This course will cover areas related to ecology - specifically in the areas of wildlife biology, wildlife management, and conservation biology. There will be some bias towards vertebrate and behavioral ecology."
"School of Sciences","Graduate Science Courses","BIOL-T 586","Principles of Ornithology","3 cr.","This course provides an introduction and overview over the biology, ecology, evolution, and behavior of birds. As a student in this course you will learn about the diversity of bird life in world, with focus on Indiana. This course will help you recognize the role of birds in the ecosystem and how they impact and interact with other organisms. You will also learn about the different ways birds are adapted to flight and to survive in all types of habitats. In terms of bird diversity, you will learn how to identify Indiana bird species by sight and sound. We will also discuss how humans impact the diversity of birds in the world, especially in Indiana. To learn observational techniques and how to identify birds, you will be required to keep and maintain a field journal with drawings and descriptions."
"School of Sciences","Graduate Science Courses","BIOL-T 587","Principles of Ornithology","3 cr.","Online Collaborative Course. This course provides an introduction and overview over the biology, ecology, evolution, behavior, and conservation of birds. Students will also learn to identify common birds by sight and sound. Regular independent bird watching trips are expected as well as a field research project on local bird diversity."
"School of Sciences","Graduate Science Courses","BIOL-T 591","History of Life","3 cr.","Online Collaborative Course. This course examines the evolutionary history of life based on the fossil record and genetic codes of existing organisms.Â  It also explores the history of changing philosophies regarding life's origin, from creation story-based religious views to the non-teleological views of modern revolutionary theory."
"School of Sciences","Graduate Science Courses","CHEM-T 510","Inorganic Chemistry","3 cr.","Online Collaborative Course. This course introduces fundamental concepts of inorganic chemistry including descriptive chemistry, bonding in coordination chemistry, organometallic chemistry, special topics in inorganic chemistry and biological inorganic chemistry."
"School of Sciences","Graduate Science Courses","CHEM-T 530","Organic Spectroscopy","3 cr.","This is a course in Organic Spectroscopy. This course is intended to give students a more complete picture of how spectroscopic methods (IR, UV, NMR, mass spectroscopy, and other methods) are used to elucidate the structure of complex organic molecules."
"School of Sciences","Graduate Science Courses","CHEM-T 540","Physical Chemistry","3 cr.","Online Collaborative Course. This course will touch on all the fundamental areas of Physical Chemistry. Emphasis is placed on content that expands the students' knowledge in the key areas and relates to concepts that are likely to be taught in introductory chemistry courses."
"School of Sciences","Graduate Science Courses","CHEM-T 550","Introduction to Biochemistry","3 cr.","Online Collaborative Course. Protein composition and structure, Enzyme kinetics, catalytic and regulatory strategies, Carbohydrates, Nucleic acids, Lipids and cell membranes, Transducing and storing energy - metabolic cycles, Responding to environmental changes."
"School of Sciences","Graduate Science Courses","CHEM-T 560","Environmental Chemistry","3 cr.","Online Collaborative Course. Chemical topics in environmental chemistry."
"School of Sciences","Graduate Science Courses","CHEM-T 570","Nuclear Chemistry","3 cr.","Online Collaborative Course. The fundamentals of nuclear chemistry and radiochemistry are covered. Topics may include nuclide types (origin, distribution), nuclide stability (quantum structure, binding energy), nuclear reactions (radioactive decay, fusion, fission), applications of nuclear phenomena (nuclear power plants, radioisotope dating, tracers, analytical techniques), and hazards (nuclear power plant accidents, biological effects of radiation)."
"School of Sciences","Graduate Science Courses","CHEM-T 590","Chemistry Capstone","3 cr.","Online Collaborative Course. Integration of knowledge and understanding from the literature that transcends subdisciplinary boundaries of chemistry."
"School of Sciences","Graduate Science Courses","MATH-T 601","Topics in Algebra","3 cr.","Online Collaborative Course. This course will cover core topics in Algebra, including Group Theory, Ring Theory, Field Theory, Commutative and Noncommutative Algebra, Number Theory, and other topics in Algebra."
"School of Sciences","Graduate Science Courses","MATH-T 610","Topics in Analysis","3 cr.","Online Collaborative Course. This course will cover graduate-level knowledge in Analysis applications, including Real Analysis, Complex Analysis, Fourier Analysis, and other topics in Analysis."
"School of Sciences","Graduate Science Courses","MATH-T 620","Topics in Topology/Geometry","3 cr.","Online Collaborative Course. Students will develop graduate-level knowledge in essential concepts of Topology/Geometry including topics in Euclidean and non-Euclidean Geometry, Point set topology, Differential Topology, Differential Geometry, and other topics in Topology/Geometry."
"School of Sciences","Graduate Science Courses","MATH-T 620","Topics in Topology/Geometry","3 cr.","Online Collaborative Course. Students will develop graduate-level knowledge in essential concepts of Topology/Geometry including topics in Euclidean and non-Euclidean Geometry, Point set topology, Differential Topology, Differential Geometry, and other topics in Topology/Geometry."
"School of Sciences","Graduate Science Courses","MATH-T 640","Topics in Differential Equations and Applications","3 cr.","Online Collaborative Course. Students will develop graduate-level knowledge in Differential Equations and Applications including Numerical Methods, Mathematics of Finance, Graph Theory, Mathematical Physics, and other topics."
"School of Sciences","Graduate Science Courses","MATH-T 650","Topics in Probability/Statistics","3 cr.","Online Collaborative Course. This course will cover graduate-level knowledge of key concepts of Probability/Statistics."
"School of Sciences","graduate","MATH-T 601","Topics in Algebra","3 cr.","Online Collaborative Course. This course will cover core topics in Algebra, including Group Theory, Ring Theory, Field Theory, Commutative and Noncommutative Algebra, Number Theory, and other topics in Algebra."
"School of Sciences","graduate","MATH-T 610","Topics in Analysis","3 cr.","Online Collaborative Course. This course will cover graduate-level knowledge in Analysis applications, including Real Analysis, Complex Analysis, Fourier Analysis, and other topics in Analysis."
"School of Sciences","graduate","MATH-T 620","Topics in Topology/Geometry","3 cr.","Online Collaborative Course. Students will develop graduate-level knowledge in essential concepts of Topology/Geometry including topics in Euclidean and non-Euclidean Geometry, Point set topology, Differential Topology, Differential Geometry, and other topics in Topology/Geometry."
"School of Sciences","graduate","MATH-T 640","Topics in Differential Equations and Applications","3 cr.","Online Collaborative Course. Students will develop graduate-level knowledge in Differential Equations and Applications including Numerical Methods, Mathematics of Finance, Graph Theory, Mathematical Physics, and other topics."
"School of Sciences","graduate","MATH-T 650","Topics in Probability/Statistics","3 cr.","Online Collaborative Course. This course will cover graduate-level knowledge of key concepts of Probability/Statistics."
