subject,level,course_code,course_title,credits
"Computing 10B And 10C, Or Com- 195, Or M187 And 199, Or 198A And 198B.",Upper-Division,188SB,Individual Studies for USIE Facilitators,1
"Computing 10B And 10C, Or Com- 195, Or M187 And 199, Or 198A And 198B.",Upper-Division,188SA,Enforced corequisite: Honors Collegium 101E. Faculty sponsor and graduate student coordinator,Unknown Credits
"Computing 10B And 10C, Or Com- 195, Or M187 And 199, Or 198A And 198B.",Upper-Division,198A,Honors Research in Economics I.,4
"Computing 10B And 10C, Or Com- 195, Or M187 And 199, Or 198A And 198B.",Upper-Division,198B,Honors Research in Economics II.,4
"Computing 10B And 10C, Or Com- 195, Or M187 And 199, Or 198A And 198B.",Upper-Division,199A,Directed Research in Economics,4
"Computing 10B And 10C, Or Com- 195, Or M187 And 199, Or 198A And 198B.",Graduate,200,Mathematical Methods in Economics,4
"Computing 10B And 10C, Or Com- 195, Or M187 And 199, Or 198A And 198B.",Graduate,200B,Mathematical Methods in Economics II.,4
"Computing 10B And 10C, Or Com- 195, Or M187 And 199, Or 198A And 198B.",Graduate,201A,Microeconomics: Theory of Firm and Con- and political transformations on human behavior both Introduction to methods of demographic analysis,Unknown Credits
"Computing 10B And 10C, Or Com- 195, Or M187 And 199, Or 198A And 198B.",Graduate,201B,"Microeconomics: Basic Concepts and Tech- demography, health, aging, labor, and broad array of grading",Unknown Credits
"Computing 10B And 10C, Or Com- 195, Or M187 And 199, Or 198A And 198B.",Graduate,201C,"Microeconomics: Game Theory with Asym- process of creating their own research, including",Unknown Credits
"Computing 10B And 10C, Or Com- 195, Or M187 And 199, Or 198A And 198B.",Graduate,M204L,Seminar: Pharmaceutical Economics and,Unknown Credits
"Computing 10B And 10C, Or Com- 195, Or M187 And 199, Or 198A And 198B.",Graduate,M236,Limited to graduate public health and eco-,Unknown Credits
"Computing 10B And 10C, Or Com- 195, Or M187 And 199, Or 198A And 198B.",Graduate,202A,Macroeconomics: Dynamics and Growth ticals. In Progress grading (credit to be given only on own papers. Faculty provide feedback and build sup-,Unknown Credits
"Computing 10B And 10C, Or Com- 195, Or M187 And 199, Or 198A And 198B.",Graduate,M204M,Seminar: Pharmaceutical Economics and,Unknown Credits
"Computing 10B And 10C, Or Com- 195, Or M187 And 199, Or 198A And 198B.",Graduate,M236,Limited to graduate public health and eco-,Unknown Credits
"Computing 10B And 10C, Or Com- 195, Or M187 And 199, Or 198A And 198B.",Graduate,211B,"Economics of Uncertainty, Information, and competition, search and coordination failures, central for credit. S/U or letter grading",Unknown Credits
"Computing 10B And 10C, Or Com- 195, Or M187 And 199, Or 198A And 198B.",Graduate,211C,Game Theory and Economic Applications,4
"Computing 10B And 10C, Or Com- 195, Or M187 And 199, Or 198A And 198B.",Graduate,212A,Topics in Advanced Theory: Search Theory. ical restriction on data. Subgroups of students report quired. S/U grading,Unknown Credits
"Computing 10B And 10C, Or Com- 195, Or M187 And 199, Or 198A And 198B.",Graduate,239A-239B-239C,Workshops: Econometrics. (4–4–,Unknown Credits
"Computing 10B And 10C, Or Com- 195, Or M187 And 199, Or 198A And 198B.",Graduate,212B,Topics in Advanced Theory: Applied Game credit. S/U or letter grading. Research paper required. S/U grading,Unknown Credits
"Computing 10B And 10C, Or Com- 195, Or M187 And 199, Or 198A And 198B.",Graduate,213A-213B,"General Equilibrium and Game Theory. duction to graduate-level research in this field. Dif- Serfdom, medieval agriculture and agricultural revolu-",Unknown Credits
"Computing 10B And 10C, Or Com- 195, Or M187 And 199, Or 198A And 198B.",Graduate,242,Economic History of U.S.,4
"Computing 10B And 10C, Or Com- 195, Or M187 And 199, Or 198A And 198B.",Graduate,214A,"Topics in Mathematical Economics: General C166C. S/U (C226B) and S/U or letter (C226A, South, slavery, technological change, rise in industrial",Unknown Credits
"Computing 10B And 10C, Or Com- 195, Or M187 And 199, Or 198A And 198B.",Graduate,243A-243Z,Topics in Economic History,4
"Computing 10B And 10C, Or Com- 195, Or M187 And 199, Or 198A And 198B.",Graduate,M215,Topics in Applied Game Theory,4
"Computing 10B And 10C, Or Com- 195, Or M187 And 199, Or 198A And 198B.",Graduate,218A-218B-218C,Proseminars: Economic Theory. Econometrics gration; gender gap in pay and rise of married,Unknown Credits
"Computing 10B And 10C, Or Com- 195, Or M187 And 199, Or 198A And 198B.",Graduate,C246A-C246B-C246C,Seminars: Economic Histo-,Unknown Credits
"Computing 10B And 10C, Or Com- 195, Or M187 And 199, Or 198A And 198B.",Graduate,219A-219B-219C,Workshops: Economic Theory hours. Econometric methods for empirical research in duction to graduate-level research in this field. Dif-,Unknown Credits
"Computing 10B And 10C, Or Com- 195, Or M187 And 199, Or 198A And 198B.",Graduate,221A,Monetary Economics I.,4
"Computing 10B And 10C, Or Com- 195, Or M187 And 199, Or 198A And 198B.",Graduate,249A-249B-249C,"Von Gremp Workshops: History of tion of papers on urban economics by students, UCLA formation costs and advertising; economic and legal",Unknown Credits
"Computing 10B And 10C, Or Com- 195, Or M187 And 199, Or 198A And 198B.",Graduate,251A,Theory and Policy of Taxation,4
"Computing 10B And 10C, Or Com- 195, Or M187 And 199, Or 198A And 198B.",Graduate,251B,"Cost-Benefit Analysis of Public Projects and U.S. and international asset prices, 1880 to 2000: ex- 273A. Public Utility Regulation",4
"Computing 10B And 10C, Or Com- 195, Or M187 And 199, Or 198A And 198B.",Graduate,252,Economics of Federalism,4
"Computing 10B And 10C, Or Com- 195, Or M187 And 199, Or 198A And 198B.",Graduate,253A-253Z,Topics in Public Finance,4
"Computing 10B And 10C, Or Com- 195, Or M187 And 199, Or 198A And 198B.",Graduate,254A-254B-254C,Workshops: Public Economics. likelihood estimation. Restrictions imposed by no-ar- Quarterly seminars for predissertation and dissertation,Unknown Credits
"Computing 10B And 10C, Or Com- 195, Or M187 And 199, Or 198A And 198B.",Graduate,C266A-C266B-C266C,Seminars: Labor Econom- paper required. S/U grading,Unknown Credits
"Computing 10B And 10C, Or Com- 195, Or M187 And 199, Or 198A And 198B.",Graduate,261A,Labor Economics I.,4
"Computing 10B And 10C, Or Com- 195, Or M187 And 199, Or 198A And 198B.",Graduate,261B,Labor Economics II.,4
"Computing 10B And 10C, Or Com- 195, Or M187 And 199, Or 198A And 198B.",Graduate,268A-268B-268C,Proseminars: Labor and Popula- wards. Effects of trade barriers. S/U or letter grading,Unknown Credits
"Computing 10B And 10C, Or Com- 195, Or M187 And 199, Or 198A And 198B.",Graduate,262A,Topics in Labor Economics,4
"Computing 10B And 10C, Or Com- 195, Or M187 And 199, Or 198A And 198B.",Graduate,262D,"Topics in Labor Economics: Development background material for proposed thesis topics, to be",Unknown Credits
"Computing 10B And 10C, Or Com- 195, Or M187 And 199, Or 198A And 198B.",Graduate,262F,"Topics in Labor Economics: Public Sector Mi- perts, UCLA faculty members, advanced graduate each) Lecture, three hours. Current research in inter-",Unknown Credits
"Computing 10B And 10C, Or Com- 195, Or M187 And 199, Or 198A And 198B.",Graduate,262P,Topics in Labor Economics,4
"Computing 10B And 10C, Or Com- 195, Or M187 And 199, Or 198A And 198B.",Graduate,263,Topics in Urban Economics,4
"Computing 10B And 10C, Or Com- 195, Or M187 And 199, Or 198A And 198B.",Graduate,C126B-C126C,"S/U grading. 4) Seminar, three hours. Quarterly seminars for predis- marizing, critiquing, and report writing. Process writing",Unknown Credits
"Computing 10B And 10C, Or Com- 195, Or M187 And 199, Or 198A And 198B.",Graduate,286A,Economic Development,4
"Computing 10B And 10C, Or Com- 195, Or M187 And 199, Or 198A And 198B.",Graduate,286B,"Cost-Benefit Analysis of Development Proj- sonnel employment as teaching assistant, associate, linkages, multinational production, and financial mar-",Unknown Credits
"Computing 10B And 10C, Or Com- 195, Or M187 And 199, Or 198A And 198B.",Graduate,287A,Topics in Development Economics: Economic 401A. Microeconomic Theory,4
"Computing 10B And 10C, Or Com- 195, Or M187 And 199, Or 198A And 198B.",Graduate,287B,Topics in Development Economics: Economic tion and market design. Letter grading. Group practice of entrepreneurship. Development of,Unknown Credits
"Computing 10B And 10C, Or Com- 195, Or M187 And 199, Or 198A And 198B.",Graduate,287C,Topics in Development Economics: Economic 402A. Macroeconomic Theory,4
"Computing 10B And 10C, Or Com- 195, Or M187 And 199, Or 198A And 198B.",Graduate,287D,Topics in Development Economics,4
"Computing 10B And 10C, Or Com- 195, Or M187 And 199, Or 198A And 198B.",Graduate,288A-288B-288C,"Proseminars: International and employment and inflation, with focus on Keynesian dents. How theory maps into policymaking. Re-",Unknown Credits
"Computing 10B And 10C, Or Com- 195, Or M187 And 199, Or 198A And 198B.",Graduate,291A,Asset Pricing,4
"Computing 10B And 10C, Or Com- 195, Or M187 And 199, Or 198A And 198B.",Graduate,291B,Asset Pricing,4
"Computing 10B And 10C, Or Com- 195, Or M187 And 199, Or 198A And 198B.",Graduate,C296A-C296B-C296C,Seminars: Asset Pricing. (4– fessional audiences. Writing taught as process—,Unknown Credits
"Computing 10B And 10C, Or Com- 195, Or M187 And 199, Or 198A And 198B.",Graduate,415,"Evidenced-Based Policy Analysis in Labor, cessing, association rules, supervised learning, clus- market efficiency, linear time series models, time-",Unknown Credits
"Computing 10B And 10C, Or Com- 195, Or M187 And 199, Or 198A And 198B.",Graduate,421,"Incentives, Information, and Markets",4
"Computing 10B And 10C, Or Com- 195, Or M187 And 199, Or 198A And 198B.",Graduate,422,International Economics,4
"Computing 10B And 10C, Or Com- 195, Or M187 And 199, Or 198A And 198B.",Graduate,423,Introduction to Applied Data Science,4
"Computing 10B And 10C, Or Com- 195, Or M187 And 199, Or 198A And 198B.",Graduate,424,Income Inequality,4
"Computing 10B And 10C, Or Com- 195, Or M187 And 199, Or 198A And 198B.",Graduate,425T,Machine Learning for Economists,4
"Computing 10B And 10C, Or Com- 195, Or M187 And 199, Or 198A And 198B.",Graduate,441B,Applied Data Management for Economists. 446. Applications of Cloud Computing and Block- empirical models of consumer demand and firm com-,Unknown Credits
"Computing 10B And 10C, Or Com- 195, Or M187 And 199, Or 198A And 198B.",Graduate,441C,"Applied Data Management for Economists. and web scraping with Python through hands-on hour; laboratory, three hours. Designed for graduate",Unknown Credits
"Computing 10B And 10C, Or Com- 195, Or M187 And 199, Or 198A And 198B.",Graduate,442A,Econometric Python Laboratory,1
"Computing 10B And 10C, Or Com- 195, Or M187 And 199, Or 198A And 198B.",Graduate,597,Individual Study: Graduate Examinations. (2 to,Unknown Credits
"Computing 10B And 10C, Or Com- 195, Or M187 And 199, Or 198A And 198B.",Graduate,442B,Master of Applied Economics Finance Labo- in any field. Understanding of how teams work and ration of PhD dissertation. S/U grading,Unknown Credits
"Computing 10B And 10C, Or Com- 195, Or M187 And 199, Or 198A And 198B.",Graduate,443,SQL and Data Management,2 to 4
"Computing 10B And 10C, Or Com- 195, Or M187 And 199, Or 198A And 198B.",Graduate,444,Stock Market and Fundamental Equity Re- settings. Letter grading. Professors,Unknown Credits
"Computing 10B And 10C, Or Com- 195, Or M187 And 199, Or 198A And 198B.",Graduate,445,"Applied Machine Learning for Economists I. (2 Lecture, three hours; discussion, one hour. Limited to",Unknown Credits
"Computing 10B And 10C, Or Com- 195, Or M187 And 199, Or 198A And 198B.",Graduate,92F,Academic Success in Undergraduate Experi- tives from disability studies and engage in class activi-,Unknown Credits
"Computing 10B And 10C, Or Com- 195, Or M187 And 199, Or 198A And 198B.",Graduate,98,Critical Issues in Education,4
"Computing 10B And 10C, Or Com- 195, Or M187 And 199, Or 198A And 198B.",Lower-Division,10,Introduction to Educational Issues and Scholar-,Unknown Credits
"Computing 10B And 10C, Or Com- 195, Or M187 And 199, Or 198A And 198B.",Lower-Division,11,"Education, Equality, and Future of American So- 100. Introduction to Philosophy of Education",5
"Computing 10B And 10C, Or Com- 195, Or M187 And 199, Or 198A And 198B.",Lower-Division,19,Fiat Lux Freshman Seminars,1
"Computing 10B And 10C, Or Com- 195, Or M187 And 199, Or 198A And 198B.",Lower-Division,89,Honors Seminars,1
"Computing 10B And 10C, Or Com- 195, Or M187 And 199, Or 198A And 198B.",Lower-Division,106B,"Lesbian, Gay, Bisexual, and Transgender Is- education policy formation and implementation; and chological development, with emphasis on personal,",Unknown Credits
"Computing 10B And 10C, Or Com- 195, Or M187 And 199, Or 198A And 198B.",Lower-Division,106C,"Diversity, Democracy, and Law",4
"Computing 10B And 10C, Or Com- 195, Or M187 And 199, Or 198A And 198B.",Lower-Division,107A,"Race, Class, and Education Inequality in U.S. African studies programs during 1960s and 1970s. In- izing dominant ideologies, and create counter-hege-",Unknown Credits
"Computing 10B And 10C, Or Com- 195, Or M187 And 199, Or 198A And 198B.",Lower-Division,107B,"Race and Education: Access, Equity, and munity schools framed as equity-focused anti-poverty sophical questions that challenge teaching profession",Unknown Credits
"Computing 10B And 10C, Or Com- 195, Or M187 And 199, Or 198A And 198B.",Lower-Division,M108,Sociology of Education,5
"Computing 10B And 10C, Or Com- 195, Or M187 And 199, Or 198A And 198B.",Lower-Division,109A,Globalization and Learning,4
"Computing 10B And 10C, Or Com- 195, Or M187 And 199, Or 198A And 198B.",Lower-Division,109B,Global Citizenship Education,4
"Computing 10B And 10C, Or Com- 195, Or M187 And 199, Or 198A And 198B.",Lower-Division,C111,Politics of Education,5
"Computing 10B And 10C, Or Com- 195, Or M187 And 199, Or 198A And 198B.",Lower-Division,M129,"Arts Education Undergraduate Practicum: Seminar, three hours; laboratory, two hours (when and opening up opportunities for challenging hege-",Unknown Credits
"Computing 10B And 10C, Or Com- 195, Or M187 And 199, Or 198A And 198B.",Lower-Division,M129XP,Arts Education Undergraduate Practicum hours (when scheduled). Requisite: course 180. Re-,Unknown Credits
"Computing 10B And 10C, Or Com- 195, Or M187 And 199, Or 198A And 198B.",Lower-Division,130AX,Instructional Apprenticeship in Teaching and 133. Literacy in Society,5
"Computing 10B And 10C, Or Com- 195, Or M187 And 199, Or 198A And 198B.",Lower-Division,130BX,Instructional Apprenticeship in Teaching used to engage young people in learning mathe-,Unknown Credits
"Computing 10B And 10C, Or Com- 195, Or M187 And 199, Or 198A And 198B.",Lower-Division,130CX,Introduction to K-12 teaching profession attention paid to equity issues. Includes fieldwork at lationships in high-tech modern medical training and,Unknown Credits
"Computing 10B And 10C, Or Com- 195, Or M187 And 199, Or 198A And 198B.",Lower-Division,130CX,"Instructional Apprenticeship in Teaching been shaped, audiences positioned, and movements port toward them making sense of them, others, and",Unknown Credits
"Computing 10B And 10C, Or Com- 195, Or M187 And 199, Or 198A And 198B.",Lower-Division,130BX,"Examination of how UCLA partners with Los lenge—neoliberal agendas, extractive policies, and Introduction to adolescence—period of tremendous",Unknown Credits
"Computing 10B And 10C, Or Com- 195, Or M187 And 199, Or 198A And 198B.",Lower-Division,M131A,"Language, Literacy, and Human Develop- munities. Look inside schools through community ser- M142. Introduction to Arts Education for Multiple",Unknown Credits
"Computing 10B And 10C, Or Com- 195, Or M187 And 199, Or 198A And 198B.",Lower-Division,143,Understanding Pathways to College,4
"Computing 10B And 10C, Or Com- 195, Or M187 And 199, Or 198A And 198B.",Lower-Division,144,"Pedagogies of Global Citizenship Education. ency with quantitative data analysis, which students Learning: Collaboration between Hammer Museum",Unknown Credits
"Computing 10B And 10C, Or Com- 195, Or M187 And 199, Or 198A And 198B.",Lower-Division,144XP,"Questions regarding nature and possibility of search and how research findings get translated when Hammer Museum, introduction to importance of in-",Unknown Credits
"Computing 10B And 10C, Or Com- 195, Or M187 And 199, Or 198A And 198B.",Lower-Division,144XP,Pedagogies of Global Citizenship Education. and test scores in educational contexts. Introduction search approach that can support art museums in un-,Unknown Credits
"Computing 10B And 10C, Or Com- 195, Or M187 And 199, Or 198A And 198B.",Lower-Division,145,"Children, Immigration, and Education",4
"Computing 10B And 10C, Or Com- 195, Or M187 And 199, Or 198A And 198B.",Lower-Division,146,"Critical Perspectives on Educational Assess- questions regression can answer, about assumptions 165. Educational Program Evaluation",5
"Computing 10B And 10C, Or Com- 195, Or M187 And 199, Or 198A And 198B.",Lower-Division,170,Exploration of Topics in Education,2
"Computing 10B And 10C, Or Com- 195, Or M187 And 199, Or 198A And 198B.",Lower-Division,171,Community Service Learning for Academic,Unknown Credits
"Computing 10B And 10C, Or Com- 195, Or M187 And 199, Or 198A And 198B.",Lower-Division,172,Activism through Community Service,5
"Computing 10B And 10C, Or Com- 195, Or M187 And 199, Or 198A And 198B.",Lower-Division,175B,Educational Leadership and Diversity in and production techniques to inform student analysis,Unknown Credits
"Computing 10B And 10C, Or Com- 195, Or M187 And 199, Or 198A And 198B.",Lower-Division,173,Dialog across Difference,4
"Computing 10B And 10C, Or Com- 195, Or M187 And 199, Or 198A And 198B.",Lower-Division,174A,Experiential Learning in Secondary Class- cultural art form intersects with development of social 180W. Orientation to Community Engagement,5
"Computing 10B And 10C, Or Com- 195, Or M187 And 199, Or 198A And 198B.",Lower-Division,174B,Experiential Learning in Secondary Class- of athletes. Study dissects current (mis)perceptions,Unknown Credits
"Computing 10B And 10C, Or Com- 195, Or M187 And 199, Or 198A And 198B.",Lower-Division,174C,Experiential Learning in Secondary Class- transformative research in education—public scholar- their portfolio. Letter grading,Unknown Credits
"Computing 10B And 10C, Or Com- 195, Or M187 And 199, Or 198A And 198B.",Lower-Division,188SA,Individual Studies for USIE Facilitators,1
"Computing 10B And 10C, Or Com- 195, Or M187 And 199, Or 198A And 198B.",Lower-Division,188SB,Individual Studies for USIE Facilitators,1
"Computing 10B And 10C, Or Com- 195, Or M187 And 199, Or 198A And 198B.",Lower-Division,188SC,Individual Studies for USIE Facilitators,2
"Computing 10B And 10C, Or Com- 195, Or M187 And 199, Or 198A And 198B.",Lower-Division,191A-191D,Current Issues in Education,4
"Computing 10B And 10C, Or Com- 195, Or M187 And 199, Or 198A And 198B.",Lower-Division,C192A,"Practicum in Intergroup Dialogue Facilita- History M264.) Discussion, three hours. History of ed- choice, cultural literacy, teacher empowerment, and",Unknown Credits
"Computing 10B And 10C, Or Com- 195, Or M187 And 199, Or 198A And 198B.",Lower-Division,195,Community Internships in Education,4
"Computing 10B And 10C, Or Com- 195, Or M187 And 199, Or 198A And 198B.",Lower-Division,217B,Cognitive Development and Education,4
"Computing 10B And 10C, Or Com- 195, Or M187 And 199, Or 198A And 198B.",Lower-Division,M217C,"Personality Development and Education. Introduction to disciplined inquiry and continuous im- tory factor analysis, multiple-group analysis. S/U or",Unknown Credits
"Computing 10B And 10C, Or Com- 195, Or M187 And 199, Or 198A And 198B.",Lower-Division,217D,Language Development and Education,4
"Computing 10B And 10C, Or Com- 195, Or M187 And 199, Or 198A And 198B.",Lower-Division,M217F,Adolescent Development,4
"Computing 10B And 10C, Or Com- 195, Or M187 And 199, Or 198A And 198B.",Lower-Division,219,Laboratory: Advanced Topics in Research teaching studies and on conceptualization of hypoth- native analytical models. Letter grading,Unknown Credits
"Computing 10B And 10C, Or Com- 195, Or M187 And 199, Or 198A And 198B.",Lower-Division,220A,"Inquiry into Schooling: Organization and ture, four hours; discussion, one hour. Exploration of factor analysis, structural equation models, item re-",Unknown Credits
"Computing 10B And 10C, Or Com- 195, Or M187 And 199, Or 198A And 198B.",Lower-Division,221,Computer Analyses of Empirical Data in Edu- tics,4
"Computing 10B And 10C, Or Com- 195, Or M187 And 199, Or 198A And 198B.",Lower-Division,222A,"Introduction to Qualitative Methods and De- tics. Instruction in SPSS, Stata, and SAS statistical tionship between education and economics, including",Unknown Credits
"Computing 10B And 10C, Or Com- 195, Or M187 And 199, Or 198A And 198B.",Lower-Division,222B,Participant-Observation Field Methods,4
"Computing 10B And 10C, Or Com- 195, Or M187 And 199, Or 198A And 198B.",Lower-Division,222C,Qualitative Data Reduction and Analysis,4
"Computing 10B And 10C, Or Com- 195, Or M187 And 199, Or 198A And 198B.",Lower-Division,222D,Qualitative Inquiry: Special Topics,4
"Computing 10B And 10C, Or Com- 195, Or M187 And 199, Or 198A And 198B.",Lower-Division,223,Procedural Issues in Evaluation,4
"Computing 10B And 10C, Or Com- 195, Or M187 And 199, Or 198A And 198B.",Lower-Division,250C,Theoretical Frameworks of Higher Education,Unknown Credits
"Computing 10B And 10C, Or Com- 195, Or M187 And 199, Or 198A And 198B.",Lower-Division,242,"Learning, Culture, and Schooling",4
"Computing 10B And 10C, Or Com- 195, Or M187 And 199, Or 198A And 198B.",Lower-Division,252B,Educational Enterprise,4
"Computing 10B And 10C, Or Com- 195, Or M187 And 199, Or 198A And 198B.",Lower-Division,243,Reflections on Methods in Social Sciences,4
"Computing 10B And 10C, Or Com- 195, Or M187 And 199, Or 198A And 198B.",Lower-Division,C244,Theory and Practice of Intergroup Dialogue: hours. S/U or letter grading. interactive maps). Students become proficient in pro-,Unknown Credits
"Computing 10B And 10C, Or Com- 195, Or M187 And 199, Or 198A And 198B.",Lower-Division,253H,Seminar: Chicanos/Hispanics and Education,Unknown Credits
"Computing 10B And 10C, Or Com- 195, Or M187 And 199, Or 198A And 198B.",Lower-Division,246A,Decision Analysis and Advanced Computer plications for schooling). S/U or letter grading. 262B. Seminar: Reading,4
"Computing 10B And 10C, Or Com- 195, Or M187 And 199, Or 198A And 198B.",Lower-Division,248,Seminar: Special Topics in Child Development,Unknown Credits
"Computing 10B And 10C, Or Com- 195, Or M187 And 199, Or 198A And 198B.",Lower-Division,254,Seminar: History of Education,4
"Computing 10B And 10C, Or Com- 195, Or M187 And 199, Or 198A And 198B.",Lower-Division,249,Theories and Methods in Developmental Sci- grading. public policy for higher education requires under-,Unknown Credits
"Computing 10B And 10C, Or Com- 195, Or M187 And 199, Or 198A And 198B.",Lower-Division,255A-255B-255C,Seminars: Special Topics,4
"Computing 10B And 10C, Or Com- 195, Or M187 And 199, Or 198A And 198B.",Lower-Division,250A,"Fundamentals of U.S. Higher Education Sys- Seminar, four hours. S/U or letter grading. and strengthened conventional social sciences theo-",Unknown Credits
"Computing 10B And 10C, Or Com- 195, Or M187 And 199, Or 198A And 198B.",Lower-Division,270,Introduction to Cultural Studies,4
"Computing 10B And 10C, Or Com- 195, Or M187 And 199, Or 198A And 198B.",Lower-Division,296I,Theory in Educational Inquiry,2
"Computing 10B And 10C, Or Com- 195, Or M187 And 199, Or 198A And 198B.",Lower-Division,275,Race and Education,4
"Computing 10B And 10C, Or Com- 195, Or M187 And 199, Or 198A And 198B.",Lower-Division,276,Contemporary Theories of Writing,4
"Computing 10B And 10C, Or Com- 195, Or M187 And 199, Or 198A And 198B.",Lower-Division,CM278,Critical Media Literacy and Politics of Gen- search designs as strategies for investigating educa-,Unknown Credits
"Computing 10B And 10C, Or Com- 195, Or M187 And 199, Or 198A And 198B.",Lower-Division,CM278L,Critical Media Literacy and Politics of ticipate in weekly teaching apprentice practicum sem- Tools,2
"Computing 10B And 10C, Or Com- 195, Or M187 And 199, Or 198A And 198B.",Lower-Division,CM278,Hands-on production experience as integral supportive learning environment where each student ucation technology infrastructure and classroom pre-,Unknown Credits
"Computing 10B And 10C, Or Com- 195, Or M187 And 199, Or 198A And 198B.",Lower-Division,280A,"Seminar: Selected Topics in Special Educa- self-reflection and critical inquiry of own identities, bi- software and multimedia elements. S/U grading",Unknown Credits
"Computing 10B And 10C, Or Com- 195, Or M187 And 199, Or 198A And 198B.",Lower-Division,281,College Access Seminar,4
"Computing 10B And 10C, Or Com- 195, Or M187 And 199, Or 198A And 198B.",Lower-Division,284,"Critical Theory in Education: Power, Politics, pirical research in literacy training",1964 to 1969
"Computing 10B And 10C, Or Com- 195, Or M187 And 199, Or 198A And 198B.",Lower-Division,285,Education and Law,4
"Computing 10B And 10C, Or Com- 195, Or M187 And 199, Or 198A And 198B.",Lower-Division,315B,Elementary Literacy Methods,3
"Computing 10B And 10C, Or Com- 195, Or M187 And 199, Or 198A And 198B.",Lower-Division,318A,Integrated Methods for Elementary Teachers. teaching methods incorporating language assessment velopment on their care and education. Introduction to,Unknown Credits
